"b'?Studying plasticity and brain development has huge implications for when to treat brain damage,"" says cognitive scientist @mbedny1. ""Can you get someone with brain damage to use different parts of the brain???https://t.co/cUzhBr44SX'",172477,2,JohnsHopkins,2020-07-11 22:51:00,0,[]
"b'""Fear is a really interesting topic right now because it\'s something that has kept us alive as human beings,"" says @LauraMurray_PhD. ""Yet it can hinder so much of our lives.""  On @PublicHealthPod, Dr. Murray talks about ""reframing"" fear with @SDesmon.  ? https://t.co/PNCYOX0jQr https://t.co/wGoQQRLabr'",172477,14,JohnsHopkins,2020-07-11 18:37:00,0,[]
"Today Johns Hopkins filed suit in the U.S. District Court in Washington, D.C., to challenge revised guidance regarding the Student and Exchange Visitor Program (SEVP). Read our full statement: https://t.co/6pLJCtJTqJ",172477,302,JohnsHopkins,2020-07-10 21:31:35,877,[]
b'.@HopkinsMedicine &amp; Baltimore City lead a new effort to provide mobile coronavirus testing in the hard-hit areas of Baltimore. @GoldenSherita says Hopkins recognizes how important is it to meet their communities where they live.   https://t.co/uZlo7LVwb6',172477,9,JohnsHopkins,2020-07-10 18:42:31,0,[]
"""When we really listen to how criminal justice is experienced and how policing is experienced on the ground, the portrait that begins to emerge is of something that bears almost no resemblance to the formal laws.” –@VeslaWeaver, @JHU_BDPs https://t.co/ZV20auXyiM",172477,4,JohnsHopkins,2020-07-10 18:13:15,9,[]
"b'The lifecycle of a killer, the SARS-CoV-2 virus.  (Infographics by @JohnsHopkins faculty @fairmanstudios and @andrewpekosz) https://t.co/RM2mo5nwXo'",172477,50,JohnsHopkins,2020-07-10 17:29:32,0,[]
"b'""Men are significantly more likely to be hospitalized, to be admitted into intensive care units, and to die from #COVID19 than women,"" says @JohnsHopkinsMMI professor @SabraKlein1998.  Here\'s what we know?and don\'t know?about why that\'s the case: https://t.co/GEnzfPQxNV https://t.co/eJZPszpukE'",172477,122,JohnsHopkins,2020-07-10 17:25:35,0,[]
Tune in live today at noon: https://t.co/Hrd8Ib6YR1 https://t.co/ThN6qaEz1O,172477,3,JohnsHopkins,2020-07-10 15:30:11,3,[]
"Across Johns Hopkins, several archival projects have launched to preserve the pandemic experiences of our university and hospital communities as learning tools for future generations. https://t.co/pEckT9m0My",172477,11,JohnsHopkins,2020-07-10 14:23:01,34,[]
b'More news on the eSchool+ Initiative?s new state reopening tracker and eSchool+ website. Exciting stuff @DrMcollins2020 @ImpactGreater @JohnsHopkins and helpful resource for the reopening schools national conversation. #WeAreinThisTogether #HopkinsLocal   https://t.co/QreN8qpc3f',172477,11,JohnsHopkins,2020-07-10 13:55:01,0,[]
"b'In a new episode of #COVIDConsiderations, @nursingdean talks about excess deaths https://t.co/tLpsI2vWhN https://t.co/AUKKU61mUB'",172477,7,JohnsHopkins,2020-07-10 13:40:01,0,['COVIDConsiderations']
"b""Read Dean @EliotACohen's message on the recent update to DHS/SVEP guidelines. https://t.co/6ZdCPChFpC https://t.co/lPIsyKUN0T""",172477,9,JohnsHopkins,2020-07-10 13:24:55,0,[]
"b'""Doing group exercise activities outdoors is going to be much more safe than doing (it) indoors,"" said @AmeshAA. ""That could be much more conducive to social distancing and putting in measures that might make it less likely to see transmission."" https://t.co/0sqZz0D6FD'",172477,13,JohnsHopkins,2020-07-10 13:24:41,0,[]
"b'Congratulations and a huge welcome to Shanon Shumpert and @DrKCald on joining the @JohnsHopkins as the new Vice Provost for Institutional Equity and Vice Provost for Diversity and Inclusion and Chief Diversity Officer, respectively.  #wewinwhensheleads #hopkinsproud #liftherup https://t.co/vO20VLfhYg'",172477,6,JohnsHopkins,2020-07-10 12:58:32,0,[]
"The #COVID19 infection rate is 5 times higher and the death rate is 3 times higher in state and federal prisons than in the general U.S. population, according to new analysis from @JohnsHopkinsSPH. https://t.co/btzhTdfbWl",172477,17,JohnsHopkins,2020-07-10 00:00:17,36,['COVID19']
"b'Join us for the next session of the #APLNationalHealth Virtual Speaker Series feat. feat. Khair ElZarrad, deputy director, Office of Medical Policy, Center for Drug Evaluation &amp; Research @US_FDA.  ?? July 14, 2020 ? 2:00 3:30 p.m. ET ? Virtual Event: https://t.co/EOPgAxsBMc'",172477,3,JohnsHopkins,2020-07-09 21:58:00,0,['APLNationalHealth']
"b'How can citizens use protest, activism, and organizing to effectively?and safely?make their voices heard, hold leaders accountable, and make real change happen? Join @SNFAgoraJHU for a live webcast with @_kanishabond_, @FilipeCampanten, @EricaChenoweth, and @hahriehan.'",172477,6,JohnsHopkins,2020-07-09 20:12:40,0,[]
"""Contact tracing helped end the Ebola outbreak in West Africa. It can help end #COVID19."" -Tolbert Nyenswah, Senior Research Associate @JohnsHopkinsSPH #COVID19RealTimeResponse https://t.co/9wncudxMqm",172477,41,JohnsHopkins,2020-07-09 19:05:17,91,"['COVID19', 'COVID19RealTimeResponse']"
"b"".@HopkinsKids' Morgan Katz appeared on @CNN to discuss the current state of contact tracing and #COVID19 testing. https://t.co/xaTvhPMuNf""",172477,11,JohnsHopkins,2020-07-09 17:57:10,0,['COVID19']
"This essential resource is provided by the JHU eSchool+ Initiative, a multidisciplinary collaboration among @bermaninstitute, @JHUeducation, @JHUSchoolHealth, @HopkinsMedicine, and @JohnsHopkinsSPH. https://t.co/9ncS9Egkhd",172477,10,JohnsHopkins,2020-07-09 15:02:01,19,[]
The new School Reopening Policy Tracker provides real-time analysis of the latest K-12 reopening guidance for every state.   Learn more and explore the tracker: https://t.co/r8oo2ys8It,172477,27,JohnsHopkins,2020-07-09 15:02:01,56,[]
b'News! I?ve got a new job and am honored to help ?@JohnsHopkins? account for its past as part of the growing ??@SNFAgoraJHU? team. Thanks to everyone at Hopkins for their belief in the power of hard history to do work in the present. https://t.co/I1gZXHRPEM',172477,89,JohnsHopkins,2020-07-09 12:52:53,0,[]
"In this moment of national reckoning with racist violence and structural racism, it is clear that we are faced with both an imperative and an opportunity to act.  Here are the next steps we are taking to inform important, necessary changes at JHU: https://t.co/RRAnqcevk6",172477,25,JohnsHopkins,2020-07-08 20:13:37,76,[]
"b'In @TheLancet, with input from @nursingdean: US withdrawal from @WHO is unlawful and threatens global and US health and security https://t.co/yH1PH7upuz https://t.co/6Rb4SIVVqL'",172477,21,JohnsHopkins,2020-07-08 19:40:26,0,[]
"b'Join us for a conversation on race relations and recent global events with Dean @EliotACohen and Ambassador @harrykthomasjr1.  ?? Thursday, July 16 | 2:00 p.m. ET ?https://t.co/q0aJHpoL6R https://t.co/AwHeWIPRBr'",172477,4,JohnsHopkins,2020-07-08 19:39:23,0,[]
"b'Women experiencing violence from intimate partners now have access to MyPlan, developed by @glass_prof, which is a unique, interactive safety app that can help them assess their risks, set priorities and plan next steps https://t.co/KoMReMXMil https://t.co/EaueAaFBWr'",172477,2,JohnsHopkins,2020-07-08 19:38:42,0,[]
"b'""If your dream job is to be a producer or an actor or a writer, what does that looks like? This series is also going to dive into how you can be a self-starter and get noticed, even during a pandemic,"" says alumna @EmmaNeedell.  https://t.co/QNlpf3UiAR'",172477,5,JohnsHopkins,2020-07-08 19:38:30,0,[]
b'Researchers @MonaShattell and @jasonfarleyJHU will enter the @SigmaNursing hall of fame at the Sigma Virtual 31st International Nursing Research Congress https://t.co/CKYO7HoEfX https://t.co/dWFrv6k7Ov',172477,3,JohnsHopkins,2020-07-08 19:38:15,0,[]
"b'In the future, as electronics get smaller and easier to lose, strangers might end up thanking #HopkinsEngineer alumnus Steve Klinkner ?86 for saving a lot more than the time lost hunting for misplaced keys. https://t.co/7pHnshhSCq'",172477,3,JohnsHopkins,2020-07-08 19:38:06,0,['HopkinsEngineer']
"@Jackfeng_man @Harvard @MIT @ICEgov We’re closely monitoring the litigation and the steps other universities are taking in response to this decision, and we will provide more details as soon as we can.",172477,2,JohnsHopkins,2020-07-08 18:14:46,2,[]
@DoloffLab @deniswirtz We are closely monitoring this litigation and other steps universities are taking in response to the administration’s decision. We'll provide more information as soon as we can.,172477,5,JohnsHopkins,2020-07-08 18:11:03,2,[]
"b'We abhor the ICE decision related to F-1 visas. We remain committed to fully supporting the many @JohnsHopkinsSPH students who may be impacted by these changes. We are working quickly and in collaboration across @JohnsHopkins to understand, address and oppose the announced rules. https://t.co/2z0xSvVTYt'",172477,181,JohnsHopkins,2020-07-08 14:53:23,0,[]
b'We are fully committed to the Johns Hopkins University Carey Business School community and any students who may be impacted by these changes. We will continue to stand with our university values and prioritize our students. https://t.co/bRT0mMAkG7',172477,7,JohnsHopkins,2020-07-08 14:51:31,0,[]
"b'This @ICEgov policy is immensely misguided &amp; deeply cruel to the tens of thousands of international students who come to the U.S. every year, and also likely to do further damage to our nation?s universities. Full statement from President Mary Sue Coleman: https://t.co/aGs4PMsRUk'",172477,88,JohnsHopkins,2020-07-08 14:04:03,0,[]
Congratulations to @JHUCarey student Jeffrey Morelli on this honor by the American Business Awards for his start-up that has played a key role in #COVID19 #contacttracing efforts. https://t.co/63rBd3JagF,172477,5,JohnsHopkins,2020-07-08 12:17:00,9,"['COVID19', 'contacttracing']"
We are deeply concerned by the guidance issued yesterday and hope to provide more information to the JHU community within this week. We remind our students of the resources available to them through our Office of International Services (https://t.co/4pKFHoBOwM).,172477,5,JohnsHopkins,2020-07-08 01:18:59,42,[]
"""We will work closely with our international student population to navigate these unnecessary and disturbing disruptions to their educational pursuits while also employing all means available to reduce their impact."" -JHU President Ron Daniels",172477,9,JohnsHopkins,2020-07-08 01:18:58,63,[]
"""SEVP has shown an utter disregard for the welfare of international students pursuing excellence in American higher education institutions, and for universities seeking to continue their missions in these most uncertain of times."" -JHU Provost Sunil Kumar",172477,13,JohnsHopkins,2020-07-08 01:18:58,49,[]
"While there are still questions to be resolved regarding the new SEVP guidance and what it means for JHU students, we take significant issue with this draconian decision that has the potential to permanently affect the lives of international students. https://t.co/WKu2iTSfG7",172477,122,JohnsHopkins,2020-07-08 01:18:58,299,[]
"b'We are bringing testing for #COVID19 to neighborhoods around Baltimore that have been designated as ?hotspots? for cases of COVID-19. To learn more about our event coming up on Thursday, July 9th go here: https://t.co/JLSGREGytW https://t.co/YRZkKcHADy'",172477,13,JohnsHopkins,2020-07-07 17:37:11,0,['COVID19']
@BaltimoreMOHS @JHConnects @HopkinsMedicine Here's the information for the one happening this Thursday: https://t.co/EfV9joqmlj,172477,2,JohnsHopkins,2020-07-07 17:31:41,2,[]
"b'TODAY from 2:00 pm-3:00 pm EDT, professor @marthasjones_, @HillaryClinton, and others will discuss #TheVotePBS in a free live event. https://t.co/KpQQFpeTEt'",172477,5,JohnsHopkins,2020-07-07 14:37:42,0,['TheVotePBS']
"b'Experts say the US will need legions of contact tracers to help contain the #coronavirus ? perhaps 100,000+.  ?While this figure may be stunning,? an April report by @JHSPH_CHS said, it?s fewer than half the number per capita that were employed in Wuhan. https://t.co/2tOEtMdZYA'",172477,29,JohnsHopkins,2020-07-07 14:36:46,0,['coronavirus']
"b'?I clearly saw this was not something that was going away in three or six months,? said Johns Hopkins nurse practitioner Consuela Thompson said. ?So how do you prepare for a new normal?? https://t.co/OOnYqhMz8U'",172477,14,JohnsHopkins,2020-07-07 14:36:30,0,[]
"b""Jails and prisons around the world have become #COVID19 hotspots.  But with 25% of the world's incarcerated population, the US is particularly vulnerable.  Hear more from @ChrisBeyrer about the threats posed by this pandemic and how prisons should respond. https://t.co/66uU1z4pdL https://t.co/5xseJF24Sh""",172477,24,JohnsHopkins,2020-07-07 14:35:15,0,['COVID19']
"Join us tomorrow for a town hall to discuss our current plans for housing, dining and student life during the fall 2020 semester. Open to all JHU undergraduates and their families.   Click here for details or to submit your question in advance: https://t.co/ZmC7UFOJqx https://t.co/yCuby1I1CK",172477,7,JohnsHopkins,2020-07-06 20:25:24,11,[]
"What the Hong Kong national security law could mean for civil disobedience, global business, and scholarship in Hong Kong, according to @SAISHopkins professor Ho-fung Hung. https://t.co/11ljErbWGr",172477,3,JohnsHopkins,2020-07-06 19:30:31,7,[]
"b'Join #SNFAgora and @SAISHopkins for ?Protest, Activism, and Organizing."" We will be joined by @_kanishabond_ @FilipeCampante and @EricaChenoweth. Our director, @hahriehan, will moderate the discussion.  Friday, July 10, 12?12:45 p.m. ET   Webcast: https://t.co/QhEYfnM0UI https://t.co/rG9dSldOtv'",172477,8,JohnsHopkins,2020-07-06 19:18:41,0,['SNFAgora']
"b'Thanks to an award from @JohnsHopkins Office of the Provost, Anna Kalbarczyk, assistant director of the Center for Global Health, will lead an event series that introduces PhD students across JHU divisions to women leaders working in global health.   https://t.co/HqcwXg4WuN'",172477,6,JohnsHopkins,2020-07-06 18:27:28,0,[]
"b'Join us today 7/6, 3-4PM for the @JohnsHopkins eSchool+ Initiative?s webinar series, Equity and K-12 School Reopening: ?Should I stay or should I go: Parent choice and school reopening,? will feature speakers from @NNPS_JHU @JHUeducation @JHSPH_CHS    https://t.co/ufrjVTCLz3 https://t.co/ihLUlZM2aZ'",172477,6,JohnsHopkins,2020-07-06 14:10:55,0,[]
"b'""We are facing a mental health crisis as a result of #COVID19,"" says @withyouDrWu. https://t.co/f9gPajzYva'",172477,32,JohnsHopkins,2020-07-05 17:51:01,0,['COVID19']
"“Reopening businesses that pose a major risk of community spread should be a lower priority than reopening schools, for which continued closure carries far greater harm.” -@JenniferNuzzo &amp; @drJoshS of @JohnsHopkinsSPH https://t.co/8JOUTY1VD2",172477,32,JohnsHopkins,2020-07-05 14:09:44,89,[]
"b""Epidemiologists and other public health experts aren't the only ones who know one of the best ways to reduce the spread of #COVID19.  Astrologists agree, too. ? https://t.co/LeCQIoOteb""",172477,330,JohnsHopkins,2020-07-04 22:25:34,0,[]
"b'Hey if you?re having an outpoor party this weekend, remember to still distance. Group photos and four people in the kitchen helping to clean up defeat the purpose.'",172477,274,JohnsHopkins,2020-07-04 22:24:30,0,[]
b'How are states looking at data to inform school and office reopenings? And how powerful is social media during the #COVID19 pandemic?  @T_Inglesby discussed with @BloombergDotOrg public health program lead @DrKellyHenning.  Listen in: https://t.co/uWjQnWCcCo https://t.co/CFmqxOpYEF',172477,18,JohnsHopkins,2020-07-03 16:13:08,0,[]
"While researchers across Hopkins rush to understand SARS-CoV-2, they're supported by a small team of contracts experts at @JHTechVentures, who help procure vital research materials. https://t.co/ouKXE6II6H",172477,7,JohnsHopkins,2020-07-03 00:27:00,26,[]
"b'?People have to make sure they?re wearing them properly, not touching their face and not discarding them on sidewalks,? says @AmeshAA. ?Masks shouldn?t give people a false sense of security.? https://t.co/vD7zcJjwl2'",172477,42,JohnsHopkins,2020-07-03 00:19:00,0,[]
"b'For 29 years, @JHUCAIH has worked closely with tribal communities to improve their health and wellbeing. Under the #COVID19 pandemic, this work has redoubled.   Their experts say there is still a staggering need for more.   Read more: https://t.co/AA5cqXkA6N https://t.co/ZX886PhgyZ'",172477,37,JohnsHopkins,2020-07-02 18:58:10,0,[]
"b""#NursesForSocialJustice: @LisaCooperMD is a Bloomberg Distinguished Professor and Director of @JHhealthequity.   She's also an incredible mentor to Hopkins nurses @ycommodore and @Alvarez11C.   Read about their relationship https://t.co/wzMIiTzUTo https://t.co/XO27c02k2P""",172477,10,JohnsHopkins,2020-07-02 18:40:32,0,['NursesForSocialJustice']
"b'""With more mobile phones than humans on this planet, the opportunity for digital health innovation and use has not been missed as the #COVID19 pandemic has unfolded,"" says @ALabriqu. https://t.co/f9gPajzYva'",172477,16,JohnsHopkins,2020-07-02 18:40:21,0,[]
"b'""I?m passionate about building programs and developing public policy to enable us and future generations to thrive in an evolving digital economy,"" says #HopkinsEngineer @melanieshimano. https://t.co/RgNbtseBXd'",172477,2,JohnsHopkins,2020-07-02 17:58:38,0,[]
"b'Congratulations @jmjafrx! ""...I\'m enthusiastic about JHU truly committing to an antiracist future, including completely abandoning its private police plans and giving Black faculty the resources they need to make structural change happen."" https://t.co/FziT2f2vYd'",172477,5,JohnsHopkins,2020-07-02 17:57:46,0,[]
"b""#JHUAlumni, the Office of Alumni Relations will close at 2 pm ET today, July 2 for the #July4th holiday weekend. We will reopen at 8:30 am ET on Monday, July 6.   Don't forget to wear your masks, wash your hands, and keep 6 feet apart while enjoying your holiday festivities! https://t.co/DBx893UWZA""",172477,3,JohnsHopkins,2020-07-02 17:56:22,0,"['JHUAlumni', 'July4th']"
"Congratulations to the winners of the 2020 Diversity Awards, recognizing exceptional contributions in advancing and celebrating diversity and inclusion at Hopkins. https://t.co/voNZN85MUX",172477,7,JohnsHopkins,2020-07-01 22:39:00,37,[]
"Once a #vaccine is developed for #COVID19, who will get it first? A conversation with bioethicist @fadenethx of @bermaninstitute: https://t.co/YDzhAf8tbp",172477,25,JohnsHopkins,2020-07-01 20:53:02,45,"['vaccine', 'COVID19']"
"b'""A common theme between what the world is witnessing right now with the #COVID19 pandemic and what I experienced back in Syria is the uncertainty,"" says Houssam Alnahhas.  Here\'s his #COVID19RealTimeResponse.  Subscribe to our newsletter for more updates: https://t.co/QFAHLqVp8Q https://t.co/A2mHDCvBBQ'",172477,35,JohnsHopkins,2020-07-01 18:34:32,0,['COVID19']
"b'Earlier this month, Michele Decker &amp; @glass_prof, co-directors of Gender Equity &amp; Justice at @JohnsHopkinsAHW received a $2.8M NIH Grant for MyPlan, a community-partnered, app-based intervention for intimate partner violence support and safety planning https://t.co/V93zO8tbrx https://t.co/8ATcBoSl7b'",172477,4,JohnsHopkins,2020-07-01 18:33:00,0,[]
"b'""Schools need to take the risk of spread seriously, for children and staff, even as they resume classroom instruction,"" write @JenniferNuzzo and @DrJoshS. https://t.co/rbGg5Qd6Lp'",172477,18,JohnsHopkins,2020-07-01 17:58:49,0,[]
"b'Are you ready to step into nursing or take the next step in your nursing career? Prospective students, here are upcoming virtual admissions events https://t.co/7070Jtjmz5 https://t.co/lTqzwnnOto'",172477,2,JohnsHopkins,2020-07-01 17:58:16,0,[]
"b'Johns Hopkins Physicians stand with the Black community today, tomorrow and forever.  #BLM #WC4BL https://t.co/cVnJqc3P1B'",172477,37,JohnsHopkins,2020-07-01 17:57:21,0,"['BLM', 'WC4BL']"
b'Join us for Day 2 of the @SAISHopkins @KissingerCenter World Order After #COVID19 Forum. Register to watch the discussion live here: https://t.co/yRxMVCcKQw #JHUworldaftercovid #SAISKissingerForum https://t.co/4dnlb2yiaJ',172477,5,JohnsHopkins,2020-07-01 15:02:12,0,['COVID19']
"b'The search for a #COVID19 vaccine presents a question for researchers: are ""challenge trials""?which involve infecting healthy volunteers?necessary to confirm efficacy?  Listen to our podcast with @JohnsHopkinsIH professor Anna Durbin to learn more.  ? https://t.co/QtHwurTEpB https://t.co/OF37EPfABF'",172477,9,JohnsHopkins,2020-07-01 15:01:55,0,['COVID19']
"“When you actually start looking at the affected populations, the breakdown of race and age and ethnicity and socioeconomic demographics, it becomes so much more human.” -Lauren Gardner (@TexasDownUnder), @JHUSystems",172477,1,JohnsHopkins,2020-07-01 14:34:04,11,[]
"“This is the first time data has been such a central part of the narrative. I think we need more of [the human connection] in the larger national narrative. It just feels like the compassion is getting lost.” -Beth Blauer (@biblauer), @civicimpact_jhu",172477,4,JohnsHopkins,2020-07-01 14:34:04,10,[]
"“The first 6 1/2 weeks, we were building the plane as it flew, and we were flying at supersonic speeds.” -Sheri Lewis, @JHUAPL",172477,2,JohnsHopkins,2020-07-01 14:34:04,4,[]
"“When we started this there was not a single dedicated covid-19 tracking website by a public health authority anywhere.” -Lauren Gardner (@TexasDownUnder), @JHUSystems",172477,1,JohnsHopkins,2020-07-01 14:34:04,4,[]
"“For those looking closely, the Hopkins project does lay out a clearly legible story about American life today, one involving economic inequality, racial disparities and poor access to health care.” https://t.co/fBaX7klB7X",172477,19,JohnsHopkins,2020-07-01 14:34:03,54,[]
"Update on fall 2020 plans for JHU undergraduates: We plan to offer an on-campus undergrad experience this fall for all who want it. Students will not be required to return to campus, and thorough health and safety protocols will be in place.  Learn more: https://t.co/WDLfjrQufF",172477,35,JohnsHopkins,2020-06-30 20:02:36,77,[]
b'Researchers at @JohnsHopkins are racing to understand the connection between SARS-CoV-2 and a deadly immune system malfunction called a cytokine storm. https://t.co/wACpNyeBxf',172477,33,JohnsHopkins,2020-06-30 19:26:14,0,[]
"b'Gaining a better grasp on how social networks affect us, for both good and ill, is the goal of research by #HopkinsEngineer Ian McCulloh. https://t.co/3KqAdBNGQk'",172477,5,JohnsHopkins,2020-06-30 19:26:10,0,[]
"""Universities responded to the pandemic with sound science and advice. We can still do more."" –JHU President Ron Daniels https://t.co/oAw5rSZxIJ",172477,24,JohnsHopkins,2020-06-30 13:55:48,55,[]
"Register Now: ""World Order After COVID-19 Forum"" June 30 - July 1, join a virtual conference of leading global experts debating national and international trends in a post-#COVID19 world. https://t.co/3Mqa1YlCph",172477,17,JohnsHopkins,2020-06-29 23:40:01,38,['COVID19']
"b'Sheridan Libraries? Ferdinand Hamburger University Archives has launched a project to encourage JHU students, staff, and faculty to preserve their personal experiences during the coronavirus pandemic/contribute them to the University Archives. Submit at: https://t.co/phE5omRRAu. https://t.co/komw8FzW9d'",172477,1,JohnsHopkins,2020-06-29 20:38:04,0,[]
We strongly object to the renewed restrictions on visas for immigrants and other foreign workers. We stand in solidarity with international scholars across academia and support potential avenues to delay or prevent the impacts from this action. https://t.co/flfBs78qdk,172477,134,JohnsHopkins,2020-06-29 19:43:45,334,[]
"""Our goal is to design a mask, comparable to the N95 respirator mask, that offers the same filtration capabilities and the same level of protection."" https://t.co/epUBBKS3kp",172477,15,JohnsHopkins,2020-06-29 18:50:02,49,[]
"@RohamRaz @AcademicChatter While this individual is no longer a member of the Hopkins community, as in all cases, OIE follows up on every report they receive to ensure appropriate action is taken. They remain available to support community members. More info &amp; resources: https://t.co/qYEKoe7PDh",172477,1,JohnsHopkins,2020-06-29 16:59:33,5,[]
"@RohamRaz @AcademicChatter Roham, we are so sorry you experienced this. We condemn the language used in this email, as it goes against our policies and values. We take this extremely seriously and our OIE is working with university partners to take appropriate action.",172477,1,JohnsHopkins,2020-06-29 16:59:17,13,[]
"b""Join leading experts for #JHUWorldAfterCovid, a virtual global conference. #JHUAPL's Christine Fox, assistant director for policy &amp; analysis, talks technology, economics, &amp; climate in a post-#COVID19 world.  ?? Wednesday, July 1 ? 10:00am-11:15am (EDT) ? https://t.co/4k8QzSEe6s https://t.co/QcdhG9P2wS""",172477,4,JohnsHopkins,2020-06-29 16:47:06,0,"['JHUWorldAfterCovid', 'JHUAPL']"
"b'Developing a National Strategy for SARS-CoV-2 Serosurveys in the United States, new report by @JHSPH_CHS with @jasonfarleyJHU and @HopkinsREACH https://t.co/uP1yaF22pE https://t.co/h7y6r1VqaS'",172477,5,JohnsHopkins,2020-06-29 15:46:29,0,[]
"b'""Physics can do better.""  #HopkinsEngineer Vice Dean for Undergraduate Education Michael Falk discusses the importance of addressing exclusionary practices in #STEM fields. https://t.co/8F4bkQeseV'",172477,5,JohnsHopkins,2020-06-29 15:45:56,0,['HopkinsEngineer']
"b'""If people who are infected, and their contacts, are safer and stay isolated, we will all be safer,"" says @DrTomFrieden. https://t.co/h84zFNWffk'",172477,58,JohnsHopkins,2020-06-29 15:43:25,0,[]
