"""The IHME model projections have changed over the course of the outbreak, as its creators have input new data from new outbreaks, new social distancing measures, and new resources (like ventilators) that have become available. (The model is regularly updated with new data).""",48466,4,IHME_UW,2020-04-11 00:02:16,9,[]
"""The hardest thing to model in all of this, is not the virus, but human behavior.""",48466,16,IHME_UW,2020-04-11 00:02:00,39,[]
"""The models change, because our actions change. The models could change for the worse if local governments declare premature victories and decrease social distancing measures too early."" (via @voxdotcom) https://t.co/rRWnPwteMY",48466,39,IHME_UW,2020-04-11 00:00:11,61,[]
"We’ll begin updating our COVID-19 projections 3 times/week. Producing daily updates has proven unrealistic given size of team, effort required to process, review, and vet large amounts of data, and implement updates. Stay tuned for our next update on 4/13. https://t.co/vB4TIkFxp5 https://t.co/AmHGxPbBKa",48466,12,IHME_UW,2020-04-10 23:30:01,48,[]
"How long does it take for social distancing measures to work? We now have a better answer based on new data from 19 locations in Italy, Spain, &amp; China where #COVID19 deaths have peaked. Learn more https://t.co/U94SmGVmrF https://t.co/9HhLf2BtiX",48466,25,IHME_UW,2020-04-10 22:30:01,41,['COVID19']
"b'Some good news: states that started social distancing early and aggressively, like California, have avoided overwhelmed health care systems. It?s critical that we continue to listen to the evidence and experts and practice social distancing. https://t.co/56RgGeAfr7'",48466,41914,IHME_UW,2020-04-10 21:36:36,0,[]
"@GauchoSoccer We are working to forecast what would happen if social distancing measures are lifted on particular dates, and we will share these projections as soon as our work is complete.",48466,1,IHME_UW,2020-04-10 19:33:31,8,[]
"CLARIFICATION: It is an underlying assumption of our model, as it looks today, that social distancing measures will remain in place until the end of May. https://t.co/6WpORBwppG",48466,31,IHME_UW,2020-04-10 19:24:23,42,[]
"@exegesisjoe Thank you, Joe. Noted, and we appreciate your feedback.",48466,1,IHME_UW,2020-04-10 19:02:59,1,[]
"@dancurry @ThinkGlobalHlth We’ll be updating our COVID-19 projections 3x per week. Producing daily updates has proven unrealistic given relative size of team + effort required to fully process, review and vet large amounts of data alongside implementing model updates. Our next update is on 4/13.",48466,1,IHME_UW,2020-04-10 19:01:13,2,[]
"""The measures we’ve taken so far won’t protect us from the virus; they only buy time—time to prepare for the next phase of our response. It is crucially important we use this time well."" A must-read on #COVID19 by @DrTomFrieden for @ThinkGlobalHlth. https://t.co/0QP43R1GQF",48466,11,IHME_UW,2020-04-10 18:06:18,13,['COVID19']
"@loupenrose Hi Lou, here's a great article that addresses your questions (via @ThinkGlobalHlth) https://t.co/0QP43R1GQF",48466,0,IHME_UW,2020-04-10 17:59:07,0,[]
"@GauchoSoccer We are not predicting policy decisions, but we are highlighting one of the core, underlying assumptions of our model. https://t.co/YjPzARRcn1",48466,2,IHME_UW,2020-04-10 17:47:34,10,[]
"b'Here is a simple explanation of how the #COVID19 models, including one by @imperialcollege and @IHME_UW, work and compare  #FlattenTheCuve #epidemiology  https://t.co/dwUGAhJn3i @pathtweets https://t.co/w8HjugpYwI'",48466,9,IHME_UW,2020-04-10 15:25:12,0,['COVID19']
"b'@IHME_UW From colleague @LydenFOX9?s interview with UW?s @AliHMokdad: ?Academics will always debate which model is better?but at this point all the models are telling us exactly the same story, social distancing is working and we should stay at home.?   (3/6)'",48466,8,IHME_UW,2020-04-10 15:20:38,0,[]
"""Until every country has the capacity to curb this epidemic, none of us will be safe."" #COVID19 https://t.co/7xrF6DcoyB",48466,26,IHME_UW,2020-04-10 13:00:01,45,['COVID19']
"Download the daily state-by-state projections of hospital resource use, daily deaths, and total deaths used in our COVID-19 data visualization. https://t.co/Mkubxnaq8b https://t.co/pctrE0DiRj",48466,6,IHME_UW,2020-04-10 09:00:01,5,[]
b'Experts: Uneven Stay-at-Home Orders Could Mean Wider Pandemic? https://t.co/0M1Vvsyu63',48466,18,IHME_UW,2020-04-10 03:36:47,0,[]
b'The IHME model revised its estimate of the death toll of covid-19 down significantly. Good news! But news that carries with it a number of warnings. https://t.co/fOk6IncxrU',48466,23,IHME_UW,2020-04-10 03:36:30,0,[]
"b'A notable shift downward in projected deaths from coronavirus is already being spun as ""experts were wrong!!"" instead of ""hey, the thing experts said would drive down deaths might be driving down deaths."" https://t.co/HpUPAyc5tx https://t.co/XLPD39dQfF'",48466,14138,IHME_UW,2020-04-10 03:35:38,0,[]
"b""US coronavirus predictions are shifting. Here's why | Analysis https://t.co/R9PynB4JZt https://t.co/xYoVUQIGL4""",48466,15,IHME_UW,2020-04-10 03:34:46,0,[]
Even just a week’s worth of additional data improves our #COVID19 model substantially and increases the reliability of our forecasts. Learn more: https://t.co/yKcydpCI8l https://t.co/USktajroBy,48466,5,IHME_UW,2020-04-10 03:00:01,24,['COVID19']
b'The most important conversation today is from @nprgreene and @shmcminn. One model shows a lower death toll. Another much more grim. Why? One assumes we follow social distancing now. The other assumes people won?t follow until their area is devastated. @NPR https://t.co/TaomiZyzQl',48466,19,IHME_UW,2020-04-10 00:26:07,0,[]
"b'Many states report COVID-19 hospitalizations differently, and the federal government is way behind on tracking.   Without consistent information, the U.S. won?t be able to properly respond as new hot spots emerge.  https://t.co/hAPc12SnKh'",48466,79,IHME_UW,2020-04-10 00:23:57,0,[]
"b""Much great work from my @NatureNews colleagues, as usual, on COVID-19. Here's @NidhiSubs on the importance of tracking daily death tolls https://t.co/XanEwKhnSS""",48466,14,IHME_UW,2020-04-10 00:21:40,0,[]
"Our #COVID19 tool is like a weather forecast for hospital administrators and state governments. We are refining our projections and adding new data regularly, and the projections may change often. Learn more: https://t.co/wEZuTl3bex https://t.co/9QEpGBngff",48466,8,IHME_UW,2020-04-10 00:00:01,19,['COVID19']
"b""This is not unusual or bad! It is just good to keep in mind the uncertainty that these projections carry with them. If all of the uncertainty we've talked about today was quantified, it's possible we'd basically have no answers to go off of ????  https://t.co/xYpvoe3d7y  14/14""",48466,2,IHME_UW,2020-04-09 23:58:27,0,[]
"b""There has been a lot of talk about the IHME Covid-19 projection model. @EpiEllie &amp; I have a chat about it in tomorrow's @casualinfer episode; here is a quick description of what is going on here with a focus on the *uncertainty*  ?https://t.co/R7mvzpMfRJ  1/14""",48466,144,IHME_UW,2020-04-09 23:58:18,0,[]
"b'Big change in UW #CoronavirusOutbreak  models nationally and in many states. For Washington, models on March 26 projected 1400 deaths. Updated model now project 632 deaths by Aug. 4 https://t.co/Jun0ZlOgme'",48466,90,IHME_UW,2020-04-09 22:45:18,0,['CoronavirusOutbreak']
@fche You can find it on GitHub here: https://t.co/bK3P2H3NfQ,48466,0,IHME_UW,2020-04-09 22:36:21,5,[]
b'The IHME projects peak COVID-19 hospital resource usage and fatalities by country and state.  ?  https://t.co/J9RG4yNkXD',48466,4,IHME_UW,2020-04-09 22:33:48,0,[]
"b'Explore this easy to use tool for projected daily mortality numbers, hospital and ICU bed shortages, disease peaks and other pandemic factors in your area. @wheisel @IHME_UW  https://t.co/0vlHLr4cS4'",48466,5,IHME_UW,2020-04-09 22:21:10,0,[]
"b'Until we develop a #COVID19 vaccine, we won?t be able to return to the way things were. Reopening will have to be gradual?loosening a tap not opening a floodgate, guided by data on progress meeting specific benchmarks. New Oped @ThinkGlobalHlth @CFR_org https://t.co/UNU96NZvjK'",48466,246,IHME_UW,2020-04-09 22:05:00,0,['COVID19']
"b""The social distancing measures we?ve taken so far won?t protect us from #COVID19; they only buy time?time to prepare the next phase of our response.  It's critical that we use this time well. In this new @ThinkGlobalHlth piece, @DrTomFrieden explains how https://t.co/h05SfSJbqG""",48466,15,IHME_UW,2020-04-09 22:03:41,0,['COVID19']
"b""Thank you @Microsoft and @jbkahan for mobilizing #AIforHealth to fight against #COVID19, including its support for @IHME_UW 's COVID-19 tool. https://t.co/LQxf8Gnx7Y""",48466,5,IHME_UW,2020-04-09 21:46:36,0,"['AIforHealth', 'COVID19']"
"Based on the latest data, we’ve adjusted how we estimate hospital resource use. Patients who do not require ICU beds have shorter stays, while patients who need ICU services are staying longer than initially projected. Read more about our changes: https://t.co/xVuxf8233l https://t.co/kRDXs0VDqv",48466,11,IHME_UW,2020-04-09 21:00:01,12,[]
"""...which they fit to mortality data and social distance data from each state in the United States. This type of model can help estimate the timing and magnitude of the peak to support hospital provision planning."" #COVID19 (via @PATHtweets)",48466,2,IHME_UW,2020-04-09 19:48:00,3,['COVID19']
"""While the majority of models are based on SEIR, the Institute for Health Metrics and Evaluation are using a statistical model which assumes that the daily deaths per population will follow a normal distribution (a bell curve)..."" #COVID19 (via @PATHtweets)",48466,2,IHME_UW,2020-04-09 19:48:00,3,['COVID19']
b'Some personal thoughts on the path forward with #COVID19 recovery. Please follow if interested. 1/10',48466,31,IHME_UW,2020-04-09 19:00:41,0,['COVID19']
"Our latest #COVID19 forecasts rely more heavily on data from the latest locations where the pandemic has peaked, such as Spain and Italy, allowing us to strengthen our models and project peak deaths and hospital resource use more accurately. https://t.co/jGNGiAkt6m https://t.co/c5p3Yl7a08",48466,8,IHME_UW,2020-04-09 19:00:02,21,['COVID19']
"New data from several states indicates a decline in the overall deaths we predict for the US. It’s important to note that our forecasts range from 126,703 to 31,221 deaths. As data comes in, our estimates will change, much like weather forecasts adjust. https://t.co/wk0u3TugF6 https://t.co/9yw5uXIRoI",48466,120,IHME_UW,2020-04-09 17:30:01,214,[]
"Why did we begin creating #COVID19 forecast models? Our director, Dr. Christopher Murray, explains. https://t.co/Ts4gjmCtkD",48466,16,IHME_UW,2020-04-09 15:00:26,28,['COVID19']
"According to our new predictions for European nations, the peak daily death rate from the pandemic will occur during the third week of April. #COVID19 https://t.co/uodzuI55rP",48466,14,IHME_UW,2020-04-09 07:30:00,14,['COVID19']
"b'Also, things are still getting worse in the UK, while improving a bit in Italy and Spain. The IHME model projects the UK to eventually have the most deaths in Europe (66K) by some margin, as compared to 20K in the next-most-affected country, Italy.  https://t.co/I7c7v7mvps'",48466,81,IHME_UW,2020-04-09 06:12:46,0,[]
"b'According to the latest @IHME_UW #COVID19 projections, peak use of hospital resources in the US will occur on 11 April ?.  All beds needed: 94,249  ?? is 15,852 short   ICU beds needed: 19,438  ?? is 9,047 short  Ventilators needed: 16,524  Read more ? https://t.co/YYJScLTzj6 https://t.co/1bWPzVBEBf'",48466,141,IHME_UW,2020-04-09 06:08:31,0,['COVID19']
"Our projections for total US #COVID19 deaths dropped from 81,766 to 60,415. Why? We’ve incorporated new data that indicates that deaths are going down. This drop may also signal that social distancing is working in the US. https://t.co/MxupsvDhPG",48466,76,IHME_UW,2020-04-09 06:00:00,132,['COVID19']
"""The model was designed to give hospitals an idea of how quickly and how much they need to expand capacity. Researchers at IHME make frequent updates to the model based on newly available data… "" #COVID19 https://t.co/Q7KphmPFRH",48466,17,IHME_UW,2020-04-09 05:00:00,44,['COVID19']
@daytonflyer2009 @6b4bc93416fe402 https://t.co/ulRqwmljjR,48466,0,IHME_UW,2020-04-09 04:17:03,2,[]
"@nogenderid We are hard at work, creating models for more countries.",48466,0,IHME_UW,2020-04-09 04:15:37,1,[]
"IHME Professor Greg Roth: ""The forecast has a range that's really important to pay attention to. If you are a health care planner, you want to be as aware of the upper range of our forecast as the mean value."" #COVID19 https://t.co/uSLScN7wKi",48466,7,IHME_UW,2020-04-09 02:54:02,21,['COVID19']
"b""Things are still getting worse, and researchers say the virus' peak has yet to come. But the main model used by the White House and many others was updated to show far fewer projected US deaths from Covid-19. Here's what to know. | Analysis by @CNNPaul https://t.co/1RkJARhnmh""",48466,135,IHME_UW,2020-04-09 02:45:57,0,[]
"@Noggienoo @euanrellie Hi Georgie, we updated the model yesterday. See here for details: https://t.co/cK0AAOAGLp",48466,0,IHME_UW,2020-04-09 02:15:54,0,[]
"Despite declining deaths in Italy and Spain, “we are expecting a foreboding few weeks for people in many parts of Europe,” says IHME Director Dr. Christopher Murray. #COVID19 https://t.co/x1QUPMHZWm",48466,17,IHME_UW,2020-04-09 02:15:00,12,['COVID19']
b'Analysis: A leading model now estimates tens of thousands fewer covid-19 deaths by summer https://t.co/IJkvlV0MMO',48466,58,IHME_UW,2020-04-09 01:54:05,0,[]
b'A ?massive infusion of new data? has led modelers at UW to revise sharply downward their estimate of how many people are likely to die from COVID-19 and suggests Washington may have already passed the peak of hospitalizations. https://t.co/tivm6Ewzi7',48466,65,IHME_UW,2020-04-09 01:52:50,0,[]
"b'A new study has predicted some 66,000 people could die in the UK with a peak of nearly 3,000 a day https://t.co/nsNCXvHYx6'",48466,14,IHME_UW,2020-04-09 01:44:04,0,[]
"b""Good news. Closely watched IHME model of #COVID19 shows continued improvement in outlook for U.S., including large states where epidemics are still in expansion phase (FL, TX, GA). But Lousiana outlook worsens. Death and disease has been tragic, but we're slowly turning a corner. https://t.co/YeAWz6pq4H""",48466,302,IHME_UW,2020-04-09 00:48:55,0,['COVID19']
"b'le previsioni dell? @IHME_UW per i Paesi che hanno ritardato il lockdown, in particolare per il Regno Unito e gli USA sono impressionanti, leggere che ci saranno rispettivamente 66,300 e 81.760 morti e? scioccante, anche la Svezia pagher? caro il ritardo'",48466,184,IHME_UW,2020-04-09 00:15:40,0,[]
"b'What\'s the peak of an epidemic? Why is it so important to ""flatten the curve""? 7 very simple questions about COVID-19 with epidemiologist Ali H. Mokdad.   @AliHMokdad @IHME_UW https://t.co/UPJc9RqDrk'",48466,9,IHME_UW,2020-04-08 23:38:14,0,[]
b'Americans across the country are making huge sacrifices to protect public health. These measures are paying off according to @IHME_UW?s latest models and are driving down the projected death toll from #COVID19. ?https://t.co/KIhdSrXK7z',48466,4,IHME_UW,2020-04-08 23:12:47,0,[]
"b'La demanda de camas de hospital en muchos pa?ses europeos exceder? la oferta. El Reino Unido necesitar? 102.794 camas de hospital en el pico, en comparaci?n con 17.765 disponibles, una escasez de 85.029 camas. #COVID?19 https://t.co/tm0sUYEb9V'",48466,5,IHME_UW,2020-04-08 23:08:35,0,[]
"b""New York's Coronavirus Deaths May Level Off Soon. When Might Your State's Peak? https://t.co/hgOvPEHl80""",48466,17,IHME_UW,2020-04-08 23:05:31,0,[]
"b'Dr. Chris Murray, director of the Institute for Health Metrics and Evaluation at the University of Washington, explains the drop in predicted deaths in their Covid-19 model. https://t.co/e6XAxQHVlJ https://t.co/o2YU2V0V7M'",48466,56,IHME_UW,2020-04-08 22:31:00,0,[]
"b""Optimism about the short-term situation (i.e. that the curve is leveling off) does not necessarily translate into optimism about the long-term situation, because the reason the curve is bending downward is social distancing and we don't rally have a plan for the next phase yet.""",48466,2105,IHME_UW,2020-04-08 22:11:35,0,[]
"b'Our estimates for total COVID-19 deaths have dropped from 81,766 to 60,415 in today?s update. Why? Because social distancing measures in the US are working. Some Americans stayed at home before the orders came. Encouraging news #COVID19 #socialdistancing ?https://t.co/KIhdSrXK7z'",48466,58,IHME_UW,2020-04-08 21:47:22,0,[]
b'Kudos to @IHME_UW team for revising models when new #data becomes available. We need more of this. Other modeling teams less transparent about changes and their impact. https://t.co/LmQyV7Se3m',48466,10,IHME_UW,2020-04-08 14:59:09,0,['data']
"b'Impressive and important effort: @IHME_UW keeps updating its #COVID19 projections (hospital beds, ICU beds &amp; ventilators required, and alas deaths) for all US states.   ?&gt; Predicts around 40k-125K more deaths by June 1  Now assess European countries too https://t.co/rMGaSc3L3z https://t.co/TDFURsRozt'",48466,5,IHME_UW,2020-04-08 14:58:58,0,['COVID19']
"It is crucial that US states continue to strongly adhere to #socialdistancing measures, says IHME professor @AliHMokdad. ""Any scaling back or interruption of social distancing measures may change the trajectory of the epidemic dramatically for the worse."" https://t.co/yaKRdwnyAp",48466,41,IHME_UW,2020-04-08 11:00:01,59,['socialdistancing']
"""The institute [IHME] said it reflects the success of so-called social distancing and warned that if those efforts are curtailed too soon, the more positive trendline might not hold."" #COVID19 #socialdistancing https://t.co/E8K7ssV8Tl",48466,9,IHME_UW,2020-04-08 09:00:01,20,"['COVID19', 'socialdistancing']"
"As this #WorldHealthDay nears end, our gratitude for nurses, midwives and all healthcare professionals on the #COVID19 frontlines will never be over. Thank you for the work you do for our families, our friends, our communities &amp; our world. #SupportNursesAndMidwives https://t.co/XOovViGsjV",48466,11,IHME_UW,2020-04-08 05:00:02,29,"['WorldHealthDay', 'COVID19', 'SupportNursesAndMidwives']"
"""IHME Director Christopher Murray said the analysis shows that Washington — the state where the virus first took hold — is also among the first places in the country to begin bringing the epidemic under control."" #COVID19 #socialdistancing  https://t.co/TFzZ1CdI95",48466,26,IHME_UW,2020-04-08 03:00:00,69,"['COVID19', 'socialdistancing']"
b'From ?@IHME_UW? today looking at Georgia.  Our peak predicted to be April 20.  By they we are predicted to have no@hospital bed shortages but a shortage of 743 ICU beds.  #SocialDistanacing starting to make an impact so these predictions may change as we #FlattenTheCuve https://t.co/m35VNWeNoX',48466,11,IHME_UW,2020-04-08 01:04:18,0,[]
"For some U.S. states, there are massive fluctuations in the number of COVID-19 deaths reported each day. To address these fluctuations, we now average the last three rounds of predictions. Learn more about this update to our US #COVID19 forecasting model: https://t.co/rxnSeyXkrm https://t.co/NXKZgl3Fpg",48466,8,IHME_UW,2020-04-08 01:00:01,18,['COVID19']
"b'UK predicted to account for 40% of deaths in Europe. Peak of nearly 3,000 deaths a day expected  ?The analysts also claim discussions over ?herd immunity? led to a delay in the UK introducing physical distancing measures?  https://t.co/AMndcljGYs'",48466,3973,IHME_UW,2020-04-07 23:31:56,0,[]
b'How bad will the coronavirus crisis get in your state?  New modeling offers some predictions.  Our tool shows when your state is projected to hit its peak ?? https://t.co/4HFKGZ2HAQ',48466,165,IHME_UW,2020-04-07 23:25:01,0,[]
b'Current modeling for North and South Carolina. #COVID19 projections assuming full social distancing through May 2020. Full link to the country and each state here--&gt; https://t.co/lqkBuAewsr https://t.co/yiIrrbz4Cj',48466,38,IHME_UW,2020-04-07 23:19:36,0,['COVID19']
"""The institute said it reflects the success of so-called social distancing and warned that if those efforts are curtailed too soon, the more positive trendline might not hold."" #COVID19 #socialdistancing https://t.co/RpJczaH9Xo",48466,17,IHME_UW,2020-04-07 23:05:20,44,"['COVID19', 'socialdistancing']"
"b'It is vital that we maintain social distancing measures, despite their steep economic cost. Even just one day without social distancing can make the cases of the virus grow exponentially. #COVID19 #SocialDistancing  https://t.co/7ASEWzIPvL'",48466,15,IHME_UW,2020-04-07 22:51:03,0,[]
"b'New UW analysis lowers coronavirus death projections, saying the state can expect roughly 632 deaths, compared to an estimate 10 days ago of more than 1,400 fatal cases of COVID-19. https://t.co/fDSZDbRznz'",48466,73,IHME_UW,2020-04-07 22:50:43,0,[]
"@Ike_Kiefer Thank you for your question. In order for you to have the best chance of getting your question answered, would you please email it to covid19@healthdata.org?",48466,0,IHME_UW,2020-04-07 21:42:52,0,[]
"@FeargusOSull Thank you for your question. In order for you to have the best chance of getting your question answered, would you please email it to covid19@healthdata.org?",48466,0,IHME_UW,2020-04-07 19:37:45,1,[]
@rocio_vicario We are working on projections for every country worldwide and hope to release them soon. Thanks!,48466,0,IHME_UW,2020-04-07 19:06:42,1,[]
@caitlin_tulloch Thank you for your question. We are working on projections for every country worldwide and hope to release them soon.,48466,0,IHME_UW,2020-04-07 19:06:26,4,[]
@RaviKundurthi We are working on projections for every country worldwide and hope to release them soon.,48466,0,IHME_UW,2020-04-07 19:06:23,2,[]
"@LastGreatAct Thank you for your question. In order for you to have the best chance of getting your question answered, would you please email it to covid19@healthdata.org?",48466,0,IHME_UW,2020-04-07 18:34:45,0,[]
#Austria #Belgium #Bulgaria #Croatia #Cyprus #Czechia #Denmark #Estonia #Denmark  #Estonia  #Finland #France #Germany #Greece #Hungary  #Ireland #Italy #Latvia #Lithuania #Luxembourg #Malta #Netherlands #Norway #Portugal #Poland #Romania #Slovakia #Slovenia #Spain #Sweden #UK,48466,7,IHME_UW,2020-04-07 18:02:59,10,"['Austria', 'Belgium', 'Bulgaria', 'Croatia', 'Cyprus', 'Czechia', 'Denmark', 'Estonia', 'Denmark', 'Estonia', 'Finland', 'France', 'Germany', 'Greece', 'Hungary', 'Ireland', 'Italy', 'Latvia', 'Lithuania', 'Luxembourg', 'Malta', 'Netherlands', 'Norway', 'Portugal', 'Poland', 'Romania', 'Slovakia', 'Slovenia', 'Spain', 'Sweden', 'UK']"
b'Pr?visions pour la France de @IHME_UW pand?mie de #COVID19  https://t.co/H5GDZQ1llM https://t.co/CeMKshZwnI',48466,5,IHME_UW,2020-04-07 16:43:01,0,['COVID19']
b'Nuevas estimaciones para Europa sobre la pandemia de #COVID19: 151.680 residentes fallecer?n y habr? una significativa escasez de camas de hospital y respiradores. | Estudio del @IHME_UW https://t.co/ihv935FGPR',48466,9,IHME_UW,2020-04-07 16:32:32,0,['COVID19']
"b""Our aim with @IHME_UW's #COVID19 forecasting model is to help hospital administrators &amp; governments plan for this pandemic. We want essential tools, like ventilators, to be sent to the right place at the right time. Discover projections for the US and EU: https://t.co/KIhdSrXK7z""",48466,15,IHME_UW,2020-04-07 16:31:52,0,['COVID19']
"Nurses and midwives play a key role in caring for people everywhere, including in times of outbreaks and settings that are fragile or in conflict. #COVID19 #SupportNursesAndMidwives https://t.co/De2qBaDQ9m",48466,7,IHME_UW,2020-04-07 15:00:08,12,"['COVID19', 'SupportNursesAndMidwives']"
"b'Data and projections #COVID19 deaths from @IHME_UW, including projected date of peak resource use, ICU beds needed and shortages of beds and ventilators by state. https://t.co/CZc8DuLm9j https://t.co/ObiRU6Vvv4'",48466,8,IHME_UW,2020-04-07 13:47:08,0,['COVID19']
"b'Encouragingly, data from Italy and Spain indicates that social distancing policies worked faster than they did in Wuhan. This new data has caused us to project an earlier epidemic peak in several US states. Learn more https://t.co/4yW1lsaYoo'",48466,20,IHME_UW,2020-04-07 13:45:28,0,[]
"Nurses, midwives, and all healthcare workers are on the COVID-19 frontline. On this #WorldHealthDay, we're proud to celebrate and support their work. #SupportNursesAndMidwives #COVID19 https://t.co/BZqMbcWl30",48466,5,IHME_UW,2020-04-07 12:00:02,12,"['WorldHealthDay', 'SupportNursesAndMidwives', 'COVID19']"
"Do you have questions about our COVID-19 model? Check out our FAQ to learn more about social distancing measures, modeling differences, and more.  https://t.co/WjdgVaPm9B https://t.co/TTvXRS1f2j",48466,5,IHME_UW,2020-04-07 11:00:01,8,[]
New data coming in from Italy and Spain provides even stronger evidence that social distancing helps #flattenthecurve. Learn more https://t.co/veqWypynCX https://t.co/vv1BYdrsji,48466,21,IHME_UW,2020-04-07 05:00:01,37,['flattenthecurve']
"After incorporating new data sources, our models indicate that #socialdistancing is working. Removing measures before the end of May could result in a rapid increase in transmission. Learn more: https://t.co/kuNitw8HI4 https://t.co/SFDXkefAl9",48466,94,IHME_UW,2020-04-07 03:00:01,130,['socialdistancing']
b'The IHME Coronavirus model has been my go-to and is one used by some of the folks on the White House task force. Today?s latest update paints a very positive picture for late May/June.  https://t.co/9X9buP55u4',48466,61,IHME_UW,2020-04-07 01:10:56,0,[]
