"Last week, dozens of cars lined up two hours early. By the end, volunteers had handed out 7,000 pounds of groceries, more than twice the amount @MDFoodBank usually hands out in an entire month. https://t.co/fnAbmITKLR",172477,4,JohnsHopkins,2020-04-15 16:59:57,5,[]
"Donations to the @MDFoodBank have declined during the #COVID19 pandemic, while demand has only increased. We've partnered with them to support Henderson-Hopkins School in a new weekly food distribution program for local families. https://t.co/0EPILLPhxC",172477,18,JohnsHopkins,2020-04-15 16:59:57,45,['COVID19']
"b'""Before lifting stay-at-home measures, states would need to see sharp declines in new cases, hospitalizations and intensive care admissions, according to @cmyeaton a senior associate at the @JHSPH_CHS."" https://t.co/YCAVJ5dGRN'",172477,23,JohnsHopkins,2020-04-15 16:53:45,0,[]
"b'Over 500,000 people have recovered worldwide, according to @JohnsHopkins. These are just some of them. https://t.co/MrpKgOUKcX'",172477,127,JohnsHopkins,2020-04-15 16:06:18,0,[]
"@JulieLarkin305 That information will be included soon, as we are in the process of updating the dataset from which we pull demographic data.",172477,0,JohnsHopkins,2020-04-15 14:51:10,0,[]
b'Congratulations to alumnus @ericsongg for being named a @PDSoros Fellow?30 immigrants and children of immigrants pursuing graduate school were selected for their extraordinary potential to give back to the United States. https://t.co/vHpBuRg4v0',172477,3,JohnsHopkins,2020-04-15 14:44:09,0,[]
"b'Recognize, release, renew with our dance department every Wednesday at 8:00 am and 5:00 pm. These Zoom sessions introduce participants to a movement and breathing practice that helps interrupt everyday patterns associated with anxiety, stress, and trauma https://t.co/zLsTvdSNkR https://t.co/AWRQrQPoil'",172477,8,JohnsHopkins,2020-04-15 14:42:00,0,[]
"b'In a @washingtonpost article on how on how militants, gangs, and mafias are responding to the #coronavirus pandemic, Prof. Sarah Parkinson (@se_parkinson) commented on why these groups are filling gaps that governments have left. https://t.co/nlwcOUXRba'",172477,10,JohnsHopkins,2020-04-15 14:41:42,0,['coronavirus']
"b'?It?s our neighborhood basically, so, getting support from your neighbors has a special kind of feeling to it,? @sibleyonline  director of community relations and outreach Andrew Huff told @DCist.  https://t.co/7SkU3LeLsa'",172477,5,JohnsHopkins,2020-04-15 14:36:39,0,[]
"b'Is getting infected with SARS-CoV-2 to ?get it over with? a good idea?  ""Quicker is not always better, as we have seen in previous epidemics with high mortality rates,"" explain @JohnsHopkinsEPI faculty. https://t.co/wDIlF1XKpI #COVID19 #coronavirus'",172477,56,JohnsHopkins,2020-04-15 14:35:12,0,[]
"b'Mark your calendars, #JHUAlumni, for VIRTUAL Alumni Weekend, May 15-17, 2020! Details to come, but for now, make sure we have your latest contact info. We can\'t wait to ""see"" you on Zoom! https://t.co/OnO9ORPJgz https://t.co/c836WeyIlh'",172477,6,JohnsHopkins,2020-04-15 14:33:33,0,['JHUAlumni']
"b'Noted for her ?directorial command? and ?technical expertise,? conductor Beth Willer will join the faculty of the Peabody Conservatory of the Johns Hopkins University as associate professor and director of choral studies in the fall 2020 semester https://t.co/vtKKKrWAcV'",172477,4,JohnsHopkins,2020-04-15 14:33:10,0,[]
"b'Miss our media webinar yesterday showcasing the new @JohnsHopkins U.S.-specific COVID-19 map w/ county-level data? Updated daily, the map will be useful for everything from local reporting to larger trend stories to data viz pieces. A few highlights ?: https://t.co/YcxXSFNVBo https://t.co/DL4mzl5QEk'",172477,13,JohnsHopkins,2020-04-15 13:57:04,0,[]
"@coffeeguy251 @JohnsHopkinsSPH @JohnsHopkinsEPI The U.S. map is updated daily, while the global map is updated throughout the day.",172477,0,JohnsHopkins,2020-04-14 21:37:17,2,[]
Congratulations to Erica Schoenberger of @JohnsHopkinsEHE on being named a Guggenheim Fellow for 2020. Her work examines contemporary environmental threats through the lens of history and economic geography. https://t.co/Bn5kMlXUcj,172477,4,JohnsHopkins,2020-04-14 18:08:31,35,[]
"b'LAST CALL for our next I-Corps session, which starts May 1! Deadline to apply is TOMORROW! More information/apply: https://t.co/M6CGTyk5E4 #startups @NSF @HopkinsMedicine @JohnsHopkins https://t.co/Sl1tWNCXEs'",172477,5,JohnsHopkins,2020-04-14 18:02:13,0,[]
"b""The #coronavirus tracking map has been viewed millions of times around the world.  This week, @JHUSystems and colleagues across @JohnsHopkins rolled out new features.  Hear about them on today's @PublicHealthPod.  ? https://t.co/w2OXOrHiYt #?? #COVID19 https://t.co/iZGlceJMZ8""",172477,36,JohnsHopkins,2020-04-14 15:53:48,0,['coronavirus']
"Amid a shortage of personal protective equipment, Baltimore-based @UnderArmour has provided 20,000 no-sew fabric masks, assembled by Hopkins volunteers, for use by non-clinical staff and asymptomatic patients. https://t.co/oET0iD4eGQ",172477,36,JohnsHopkins,2020-04-13 23:45:01,124,[]
"b""To get ahead of #COVID19, the US must expand contact tracing efforts and the public health workforce, say @JHSPH_CHS experts.  This has been done in more complicated settings, says @JohnsHopkinsIH's Tolbert Nyenswah, who led Liberia's #Ebola response. https://t.co/2GDObunbE6""",172477,31,JohnsHopkins,2020-04-13 21:58:56,0,['COVID19']
"b'The high percentage of positive results from #COVID19 tests indicates the United States has ?not yet found the edges of the outbreak? and is not ready to transition from a stay-at-home strategy to a cautious return to normalcy, said @CMYeaton. https://t.co/SIxdoy9Btd'",172477,61,JohnsHopkins,2020-04-13 21:58:51,0,['COVID19']
"b'Faculty artist @PeledAmit brought his neighborhood together in a way they never had before as he took his weekly ""CappuCello"" performance outside https://t.co/ughDBNMtPN'",172477,6,JohnsHopkins,2020-04-13 21:58:35,0,[]
"b'#HopkinsEngineer Erica Schoenberger, a @JohnsHopkinsEHE professor, has received a 2020 Guggenheim Fellowship, a prestigious distinction that recognizes achievements and exceptional promise in scholarship or creative arts. https://t.co/FWnCVFJ54t'",172477,4,JohnsHopkins,2020-04-13 21:58:23,0,['HopkinsEngineer']
"b'To re-open the US, contact tracing must be scaled up and the public health workforce must be expanded significantly, say @JHSPH_CHS experts in a recent report. https://t.co/2GDObunbE6'",172477,66,JohnsHopkins,2020-04-13 17:15:26,0,[]
"b'""Anything that indicates your lungs are being affected, instead of your throat, is an important difference for going to the hospital versus staying home,"" says @HopkinsBayview expert Eric Howell. https://t.co/amMHaops56'",172477,93,JohnsHopkins,2020-04-13 17:14:54,0,[]
"b""New research from @JHUEPS' Chao He and @PlanetDr suggests that sulfur can significantly affect how scientists interpret data about planetary atmospheres in their search for extraterrestrial life. https://t.co/kMPnU7QPXn""",172477,7,JohnsHopkins,2020-04-13 17:14:23,0,[]
"b'#COVID19 and the Digital Divide in Baltimore City Schools  School closures have a significantly different impact on the health, education, and well-being of our neediest families  By @LFrancisRN https://t.co/eWpTxTMIdN https://t.co/049cvMlCKa'",172477,5,JohnsHopkins,2020-04-13 17:13:08,0,['COVID19']
"b""Join us at 3 pm eastern TODAY, 4/13 as #JHUAlumni Anthony Garay @HopkinsEngineer '19, @JHUArtsSciences Bill Kirst ('00) &amp; Veronica Lopez ('11) &amp; Anika Penn @JHUSAIS '10 share stories about working, studying, living from a distance. Details: https://t.co/EqdcaP61p1 https://t.co/LYxUTcdMq8""",172477,5,JohnsHopkins,2020-04-13 17:12:21,0,['JHUAlumni']
"b""What are experts' greatest fears about moving forward into the next phase of the #COVID19 pandemic?  On today's @PublicHealthPod, @DrTomFrieden talks to @JohnsHopkinsCCP's @SDesmon to find out.  ? https://t.co/OOhL9Lb3z7 #?? #coronavirus https://t.co/pI4VQ3BY8r""",172477,8,JohnsHopkins,2020-04-13 15:57:48,0,['COVID19']
"b'JUST RELEASED: @JHSPH_CHS and @ASTHO have released a new report, ?A National Plan to Enable Comprehensive #COVID19 Case Finding and Contact Tracing in the U.S.?  The report outlines key next steps in the battle against the novel #coronavirus.  ? https://t.co/BGbLfQGgqx https://t.co/SbEhZurMnm'",172477,317,JohnsHopkins,2020-04-13 15:56:28,0,['COVID19']
"@cbazaluk This data is available as a toggle at the bottom of the ""Total Deaths"" column to the right of the map. If you're viewing on mobile, try switching to desktop view and you'll see you can change the ""Total Deaths"" column to instead display ""Total Recovered.""",172477,0,JohnsHopkins,2020-04-13 15:23:02,0,[]
"@OkeyMor57 At the bottom of the ""Total Deaths"" tab, click the arrow to toggle the view to ""Total Recovered."" Depending on your browser width, these arrows may display instead as tabs reading ""Deaths"" and ""Recovered,"" but the data is still available.",172477,0,JohnsHopkins,2020-04-13 15:21:24,0,[]
"@sallyvixen The number of recovered can be viewed in a separate tab on the right side of the desktop version. At the bottom of the ""Total Deaths"" column, just click the tab that says ""Recovered"" to toggle to view ""Total Recovered"" data.",172477,0,JohnsHopkins,2020-04-13 15:19:08,0,[]
"""This entirely changes what scientists should look for and expect when they examine atmospheres on planets beyond our solar system."" –Chao He, @JHUEPS https://t.co/XgBKbH3alY",172477,15,JohnsHopkins,2020-04-12 20:58:52,24,[]
Johns Hopkins engineers have developed a prototype to address ventilator shortages. Their 3D-printed ventilator splitters will allow a single ventilator to treat multiple patients. https://t.co/7Bd3funYC4,172477,176,JohnsHopkins,2020-04-11 21:22:36,417,[]
"Tonight we #LightUpBlue to show our deep gratitude and respect for #HealthCareHeroes and essential workers on the front lines of the #COVID19 pandemic, here in Baltimore and around the world. https://t.co/TEdtczeezq",172477,123,JohnsHopkins,2020-04-11 03:18:18,522,"['LightUpBlue', 'HealthCareHeroes', 'COVID19']"
"b'Tomorrow from 6 pm to 8 pm, @JohnsHopkins, @HopkinsMedicine, the Baltimore Health Dept. and @bmorechildren are hosting a PARTY with @djkeebeepooh_ ! Will @councilpresbms, @SafePhD, @AudreyLynnJo @tishaedwards1913, @drtishcommish, @bacdst  #HopkinsConnects #weareinthistogether https://t.co/TKMbbpLwCm'",172477,11,JohnsHopkins,2020-04-11 02:43:13,0,[]
"b""Sheridan Libraries' Special Collections is pleased to announce this week's toymaker challenge! Partake in the fun, share your toy with #jhumakestoys and perhaps glory will be yours! For more information, check out our blog at https://t.co/WHyeT6WGLi #hopathome #jhuathome https://t.co/7wtXJ6wcJ2""",172477,13,JohnsHopkins,2020-04-10 22:15:55,0,[]
b'#HopkinsEngineers with the @JohnsHopkins Minor League Scheduling Research Team are trying to create a new batch of shortened 2020 schedules for minor leagues in response to the #COVID19 pandemic. https://t.co/I4vHIut8Qm',172477,3,JohnsHopkins,2020-04-10 19:27:41,0,['HopkinsEngineers']
"b'""Mindboggling.""  That\'s how Aaron Tobian, a pathologist and director of the Division of Transfusion Medicine at  @HopkinsMedicine, describes the speed of the spread of the #COVID19 virus?and @JohnsHopkins\'s lightning-fast response to the #pandemic. https://t.co/1JBEe52CxV'",172477,77,JohnsHopkins,2020-04-10 19:20:41,0,[]
"b'Check out our new #COVID19 info page, with news and resources for the @JohnsHopkins community as well as our startups, including funding opportunities. https://t.co/jdpP7PBZTp https://t.co/MuiMBOfAHX'",172477,19,JohnsHopkins,2020-04-10 19:20:17,0,['COVID19']
"New data visualization tools offer real-time insight on the trends of the #COVID19 pandemic, thanks to a Hopkins-wide collaboration led by @civicimpact_jhu. https://t.co/w1hcQjyR0c",172477,60,JohnsHopkins,2020-04-10 19:00:31,107,['COVID19']
"b'Francesco Clark, founder/CEO of @ClarksBotanical, plans for his company to produce hand sanitizer ""indefinitely."" Adding a bottle of hand sanitizer to all orders, selling bottles at cost, and donating bottles to health care workers. #CleanHandsClearMind https://t.co/ib4AOEuFSz'",172477,11,JohnsHopkins,2020-04-10 17:13:09,0,[]
"b'American education will be transformed by the #COVID19 pandemic. The School of Education?s trove of relevant news, research, and resources will help families, teachers, and district leaders emerge from the crisis stronger than ever. https://t.co/IAdfmuWfqq'",172477,14,JohnsHopkins,2020-04-10 17:11:57,0,['COVID19']
b'Nurses weigh their principles vs safety in virus fight - w comments from our Cynda Rushton (@CyndaEthx) https://t.co/DtXKfyLrj9',172477,25,JohnsHopkins,2020-04-10 17:08:23,0,[]
"b'During the #coronavirus crisis, Bloomberg Fellow @moni_gv is working across institutions, government, university, and community to identify the most urgent needs of Latinx families and respond in the field. #FellowsontheFrontlines @jhcentrosol https://t.co/mzNwcvbFAn https://t.co/cOLJtk4nXx'",172477,14,JohnsHopkins,2020-04-10 17:08:07,0,['coronavirus']
"b""#JHUAPL is leveraging cutting-edge capabilities and applying broad technical expertise to work alongside military and civilian partners in support of the #COVID19 response. From disease surveillance to biological R&amp;D, here's a list of our efforts: https://t.co/0CpBGjek5b https://t.co/fVTP18YhMR""",172477,17,JohnsHopkins,2020-04-10 17:07:29,0,['JHUAPL']
"b'Don\'t miss the next #LookingForward at @JohnsHopkins lecture: ""Do You Really Want to Hear From an Epidemiologist at a Time Like This?""  with @JohnsHopkinsSPH dean emeritus Al Sommer. TODAY at noon! Register to watch: https://t.co/gk4v7Up7d7'",172477,14,JohnsHopkins,2020-04-10 13:06:42,0,['LookingForward']
A @JHUArtsSciences sociologist and historian compares responses to past pandemics and COVID-19 and describes how they can help us shape a better society. https://t.co/cfV2tMDDI5,172477,40,JohnsHopkins,2020-04-09 20:04:06,69,[]
b'Members of #JHUAPL?s informal maker community are working to 3D print face shields for medical workers currently battling the #covid19 pandemic. https://t.co/yEixgDS1Tg https://t.co/lGP5qtD0tu',172477,48,JohnsHopkins,2020-04-09 19:59:27,0,['JHUAPL']
@PCunningham57 @CNN Our team that manages the dashboard is aware of the discrepancy in the number of cases currently being displayed for the U.S. They're looking into it now. Thanks for your patience.,172477,0,JohnsHopkins,2020-04-09 19:14:44,1,[]
@blobert The @JHUSystems team is looking into this now. Thanks for your patience as they work to resolve the data discrepancy.,172477,0,JohnsHopkins,2020-04-09 18:50:23,1,[]
@ranjitksingh @MVresistance @JohnsHopkinsSPH Our team that manages the dashboard is aware of the issue with the number being displayed for U.S. cases. They're looking into it now.,172477,0,JohnsHopkins,2020-04-09 18:48:33,3,[]
@Helene_Foucart @jodixu The @JHUSystems team is aware of and looking into the discrepancy in the number of cases currently being displayed for the U.S. Thanks for your patience.,172477,0,JohnsHopkins,2020-04-09 18:34:08,2,[]
"@jodixu During our verification process we found some of the recently reported cases in France may be duplicated. We’ll continue to investigate to determine the true number and adjust accordingly once confirmed. In the meantime, we’ll use the data reported by the French government.",172477,1,JohnsHopkins,2020-04-09 16:36:28,3,[]
"b'""We have good data that simply by reducing what\'s released in a cough or sneeze reduces potential airborne transmission of a bacteria,"" says @JasonFarleyJHU. ""So it stands to reason that that would also work for viral particles as well."" #COVID19 https://t.co/yvE8eogS8t'",172477,13,JohnsHopkins,2020-04-09 15:40:29,0,[]
"b'""We don\'t know what\'s going to happen in China and elsewhere when people come out again and begin resuming regular social activities,"" says @ResolveTSL\'s @DrTomFrieden.  We must re-open carefully, he says.  ? https://t.co/OOhL9Lb3z7 #?? #coronavirus https://t.co/pI4VQ3BY8r'",172477,24,JohnsHopkins,2020-04-09 15:39:55,0,[]
"b'""People in vulnerable groups are not only at increased risk of contracting #COVID19, but they are also at risk for contributing to its spread, straining medical resources and increasing the risk for everyone,"" write @LisaCooperMD and @DrJoshS. https://t.co/PJ8286H40I'",172477,31,JohnsHopkins,2020-04-09 15:38:57,0,['COVID19']
"By analyzing Twitter data, JHU researchers found a profound impact on the movement of Americans, indicating #socialdistancing recommendations are having an effect. https://t.co/fihEARFpz6",172477,41,JohnsHopkins,2020-04-09 14:35:03,84,['socialdistancing']
"@AndriesVenter @Nerdpfleger During our verification process we found some of the recently reported cases in France may be duplicated. We’ll continue to investigate to determine the true number and adjust accordingly once confirmed. In the meantime, we’ll use the data reported by the French government.",172477,2,JohnsHopkins,2020-04-09 14:21:12,2,[]
Get expert tips for taking care of your mental and physical health during this stressful time: https://t.co/AD1nWDvQRz,172477,30,JohnsHopkins,2020-04-08 22:52:01,43,[]
"How has #COVID19 impacted the global supply chain? An operations management expert from @JHUCarey discusses challenges related to social distancing, stockpiling, and supply shortages. https://t.co/1zsAFH9ytN",172477,23,JohnsHopkins,2020-04-08 20:32:54,40,['COVID19']
"""What we do for flu in a year, we're trying to do in a month for COVID-19. Our window of acting is a small one."" –Andrew Pekosz (@AndrewPekosz), vice chair of @JohnsHopkinsMMI https://t.co/Au9j9q4sXo",172477,11,JohnsHopkins,2020-04-08 19:26:11,43,[]
"“You’re thinking about the people in the background—the health, social, and economic impacts. Having insight into what is going on can be a little bit stressful.” –Evan Bloch, pathologist at @HopkinsMedicine",172477,2,JohnsHopkins,2020-04-08 19:26:10,16,[]
"“If there's a hole in the boat, it doesn't matter if it's on my side or your side, we're all going down. If this is happening in Italy, there is absolutely no reason why this could not happen in Baltimore.” –Shmuel Shoham (@ShohamTxID), associate professor at @HopkinsMedicine",172477,9,JohnsHopkins,2020-04-08 19:26:10,21,[]
"""I absolutely think this could be the best treatment we have for the next few months."" –Aaron Tobian, pathologist and director of the Division of Transfusion Medicine at @HopkinsMedicine https://t.co/x4E60s1WsL",172477,5,JohnsHopkins,2020-04-08 19:26:10,19,[]
"""The greatest thing about being human is the capacity for empathy, the ability to care for others and be optimistic in the worst of times."" –Arturo Casadevall (@ACasadevall1), @JohnsHopkinsMMI chair leading Hopkins’ convalescent serum therapy research https://t.co/sRyYl61B1T",172477,40,JohnsHopkins,2020-04-08 19:26:09,77,[]
Meet the Johns Hopkins scientists behind a promising #COVID19 therapy heading soon into clinical trials. The team is optimistic the therapy could be used to treat the infected and boost the immunity of those most at risk of contracting the disease. https://t.co/mbNolCC8ba,172477,117,JohnsHopkins,2020-04-08 19:26:09,218,['COVID19']
"b'A new online resource from @JohnsHopkins provides access to live sessions with faculty, as well as recorded lectures and presentations. https://t.co/nAQfWRBpWh'",172477,19,JohnsHopkins,2020-04-08 18:04:32,0,[]
235 teams across the globe came together last weekend to solve challenges related to #COVID19 during @jhu_cbid's virtual hackathon. Our university has committed to funding some of these ideas into real-life solutions. https://t.co/ID9fEWyhQJ,172477,15,JohnsHopkins,2020-04-08 16:57:19,48,['COVID19']
"b'Join us for a #webinar on Funding the Response to #COVID19 Crisis, Dealing with the Consequences in #EU and USA.  ?? Thursday, April 9 | 6:30 p.m. ET ?https://t.co/dmc3TsKBMK https://t.co/pC0GO4ETKy'",172477,16,JohnsHopkins,2020-04-08 13:27:36,0,"['webinar', 'COVID19', 'EU']"
"b'""It\'s critical that we differentiate testing for the virus itself, compared to the testing for those who\'ve recovered from the [novel #coronavirus],"" says @JasonFarleyJHU on @PublicHealthPod. https://t.co/gwv8HChaGz'",172477,26,JohnsHopkins,2020-04-08 13:24:36,0,[]
"Before we can begin transitioning back to normalcy, we must see reduced transmission of #COVID19, increased testing, and a health care system that can safely and adequately treat the sick. @C_R_Watson of @JHSPH_CHS explains: https://t.co/BXYiv5Mvmz",172477,129,JohnsHopkins,2020-04-07 23:56:00,245,['COVID19']
"""I have been deeply moved by the resiliency, determination, and almost fathomless reserves of grace with which Johns Hopkins—each of you—is showing up, forging ahead, and getting through this historic moment as one community.""  Pres. Daniels' full message: https://t.co/7TCa5JNPCu",172477,13,JohnsHopkins,2020-04-07 20:49:16,67,[]
"b""This week, @JHSPH_CHS's @T_Inglesby wrote a thread (below) about the importance of modeling good social distancing behaviors in public.  At today's briefing with @LarryHogan, note the distance between participants, and also how Dr. Inglesby minimized contact with the podium. ? https://t.co/jV4ZSwgsRr https://t.co/fRgmZaKnhW""",172477,24,JohnsHopkins,2020-04-07 18:44:14,0,[]
"""It's a time of great stress and uncertainty, and nurses are rising to the challenge."" Q&amp;A with nursing ethics expert Cynda Rushton of @JHUNursing and @bermaninstitute: https://t.co/WbQKOhHt46",172477,21,JohnsHopkins,2020-04-07 17:58:17,56,[]
b'#COVID19 highlights how important it is for #HealthCareHeroes to have the most up-to-date info &amp; critical #PPE to safely provide care &amp; reduce the rate of infection in health settings.  #WorldHealthDay https://t.co/BdDkQwflRr',172477,34,JohnsHopkins,2020-04-07 14:23:41,0,"['COVID19', 'HealthCareHeroes', 'PPE']"
How can we track the spread of #COVID19? @JHUAPL researchers are using genome sequencing to shed light on how the virus evolves as it spreads and how well containment efforts are working. https://t.co/RPT2gDVHJ0,172477,30,JohnsHopkins,2020-04-07 14:01:54,62,['COVID19']
"b'#JHUAlumni, join us TODAY, 4/7 at noon ET for our first, live @JohnsHopkins at Home lecture: ""How long is too long? Communication, expectations &amp; compliance w/stay-at-home orders"" w/ @JHUCarey\'s @Mario_Macis &amp; guest @SAISHopkins\' @DavidCUnger. Details: https://t.co/DHhO0AzqyM https://t.co/syfO5AeZzN'",172477,9,JohnsHopkins,2020-04-07 13:56:25,0,['JHUAlumni']
"b'In the fight against #COVID19, nurses face high-stakes decisions and #moraldistress, with @CyndaEthx #WorldHealthDay https://t.co/fcHtIyV1Hk'",172477,25,JohnsHopkins,2020-04-07 13:12:44,0,"['COVID19', 'moraldistress', 'WorldHealthDay']"
"b'""We find ourselves with a silent but common challenge of loneliness that people are struggling with ... all over the world,"" says @Vivek_Murthy. ""And now on top of that, we\'re being asked to pull back from life-sustaining interactions with other people."" https://t.co/AJ85frIfik'",172477,33,JohnsHopkins,2020-04-07 13:12:33,0,[]
"b""The response to the novel coronavirus in Singapore been more successful than elsewhere.  To find out more about their approach, and how #SARS informed the response to #COVID19, @DrJoshS spoke with Dr. Vernon Lee from Singapore's ministry of health. https://t.co/5UnV6Vtk4b""",172477,51,JohnsHopkins,2020-04-07 13:07:10,0,[]
An update on operations at Johns Hopkins University amid the evolving global COVID-19 pandemic: https://t.co/8I25Q9xupW,172477,21,JohnsHopkins,2020-04-06 22:01:25,38,[]
"b'By using Twitter data, @mdredze of @JohnsHopkins can see if social distancing is working: https://t.co/GSBiO0WCtt'",172477,10,JohnsHopkins,2020-04-06 20:09:16,0,[]
"b""From tomatoes to cancer cells, #HopkinsEngineer @mike_schatz and others at @JohnsHopkins go deep inside genomes to unlock the secrets to life's variety. https://t.co/sVOsoWgcI3""",172477,9,JohnsHopkins,2020-04-06 18:16:58,0,['HopkinsEngineer']
Older people living in long-term care facilities during the COVID-19 pandemic face particular challenges. Alice Bonner of @JHUNursing explains: https://t.co/2QQGwJZhDE,172477,20,JohnsHopkins,2020-04-06 17:50:36,31,[]
"b'Misinformation about #COVID19 purporting to come from @JohnsHopkins is circulating widely online, including one particular message described as an ""excellent summary.""  To be clear: this ""summary"" has no connection to @JohnsHopkins or @JohnsHopkinsSPH. https://t.co/TWfDFzjyze'",172477,44,JohnsHopkins,2020-04-06 16:47:22,0,['COVID19']
A JHU student created a presentation for her family in Thailand about how #socialdistancing can slow the spread of #COVID19. Her video has since become a centerpiece of the Thai government's response to the virus. https://t.co/IbZSXNKTF5,172477,20,JohnsHopkins,2020-04-06 15:32:31,48,"['socialdistancing', 'COVID19']"
b'Why do men seem to have worse outcomes with #COVID19 than women?  @SDesmon talks to @SabraKlein1998 @RosemaryJMorgan about the impact sex and gender have on the #coronavirus pandemic.  ? https://t.co/VJmQh0ahL8  https://t.co/pI4VQ3BY8r',172477,33,JohnsHopkins,2020-04-06 14:54:47,0,['COVID19']
"b'There are seven steps that cities should immediately take to slow and prevent the transmission of the novel #coronavirus, according to @JohnsHopkinsSPH faculty. https://t.co/fFTB7r3kKa #COVID19'",172477,136,JohnsHopkins,2020-04-06 14:53:45,0,[]
b'Check out JHU?s ?Hop At Home? activity book with creative fun for young kids at home https://t.co/ut3Fj5DXlO #activitiesforkids',172477,4,JohnsHopkins,2020-04-06 14:53:26,0,[]
"b'Volunteers are creating 5,000 plastic face shields a day for use by clinicians at @HopkinsMedicine. https://t.co/asYB5lGfzb'",172477,37,JohnsHopkins,2020-04-06 14:53:21,0,[]
