"As shown in the map below, for the week of May 9 to May 15, at least 80% of survey respondents in 18 states said they sometimes or always wore masks when leaving their home. https://t.co/K3uH9fex4U",48466,3,IHME_UW,2020-05-20 15:59:38,1,[]
"With these caveats in mind, our team ran exploratory analyses to examine whether any patterns emerged regarding mask use within the US.",48466,1,IHME_UW,2020-05-20 15:59:38,1,[]
"They are also based on a convenience sample, and thus users are not formally sampled to receive the interview; subsequently, it is not clear if these data are representative of each state’s broader populations beyond those who use @premisedata and are contributors.",48466,1,IHME_UW,2020-05-20 15:59:36,1,[]
"Such data are collected on a daily basis from contributors, which means these data are subject to various limitations related to self-reporting of behaviors.",48466,1,IHME_UW,2020-05-20 15:59:35,1,[]
"One topical area covers the use of masks or cloth face coverings, asking app users whether they always, sometimes, or never use masks when they leave their homes.",48466,1,IHME_UW,2020-05-20 15:59:35,1,[]
".@PremisesStudios, a crowd-sourcing data collection company, is currently collecting sentiment data on COVID-19 through its 1.8 million contributors in 100 countries.",48466,1,IHME_UW,2020-05-20 15:59:35,0,[]
"Yet such a #COVID19 surge has yet to materialize, suggesting that increases in human mobility alone may not fully capture risk of transmission.",48466,1,IHME_UW,2020-05-20 15:59:34,0,['COVID19']
"With mobility rising throughout the US over the last several weeks, our team had expected to see large increases in reported COVID-19 cases and deaths in more recent days. After all, the time lag between heightened mobility &amp; potential rise in infections is approximately 2 weeks.",48466,1,IHME_UW,2020-05-20 15:59:34,0,[]
It is worth noting that we have not yet formally incorporated mask use into our broader estimation framework; this in-progress work offers important insights into the ever-changing dimensions of human behavior and its relationship to COVID-19 pandemic.,48466,1,IHME_UW,2020-05-20 15:59:33,1,[]
Our 5/18 #COVID19 projections update provides more information on a new area of work – quantifying the general public’s mask use in the United States – as well as a summary of key results in the US based on the latest available data. https://t.co/cK0AAOAGLp,48466,5,IHME_UW,2020-05-20 15:59:33,5,['COVID19']
"b'What are some next steps for Murray &amp; the @IHME_UW team?  ? To expand into projections for Sub-Saharan Africa, India (by state), all low and middle income countries, US counties ? Extending forecasts to the end of 2020'",48466,1,IHME_UW,2020-05-20 15:57:04,0,[]
"b'Here is the @IHME_UW model that Murray is speaking about ? It is a hybrid death and SEIR [susceptible (S), exposed (E), infected (I), and resistant (R)] statistical model which reports daily trends in deaths, cases and hospitalizations, updated 3x week.  https://t.co/NEixv8TQzB'",48466,3,IHME_UW,2020-05-20 15:53:39,0,[]
https://t.co/VpCtwX9iX1 https://t.co/OcHNuHeS5g,48466,2,IHME_UW,2020-05-20 15:53:28,0,[]
"b""Murray is speaking about modeling coronavirus outbreaks- when will we know we can lift restrictions?  Murray's key areas of work include mapping critical diseases and risks at the local level across the world &amp; providing policy scenarios for future health scenarios.""",48466,1,IHME_UW,2020-05-20 15:49:57,0,[]
b'ICYMI Got questions about #COVID19? These are the people to ask ?. Join the @GairdnerAwards TODAY @ 11am EST to discuss COVID-19 and the road forward. https://t.co/dN64oIwQFG @ProfAbdoolKarim @CAPRISAOfficial @LKSIoV @IHME_UW @GSK #SciComm https://t.co/lM7oNTw3bT',48466,2,IHME_UW,2020-05-20 15:34:55,0,['COVID19']
b'New #Covid_19 deaths and changes in @IHME_UW deaths projections from our last model. https://t.co/3G2EQfhAKF',48466,4,IHME_UW,2020-05-20 13:52:56,0,['Covid_19']
b'?C?mo se predicen las muertes por coronavirus a partir de un modelo? El doctor Rafael Lozano del @IHME_UW explica a la Voz de Am?rica.   https://t.co/TEvkzoxwQj https://t.co/mVeofEkhH3',48466,8,IHME_UW,2020-05-20 13:51:02,0,[]
"On May 21, @AliHMokdad will join Dena Morris and Dr. Albert Wettstein for a discussion surrounding how #healthcare is paid for in other countries and what we can learn from them to help improve our outcomes domestically. Register today: https://t.co/wg64Xu4PD2",48466,1,IHME_UW,2020-05-20 11:00:00,1,['healthcare']
"""Understanding the underlying assumptions that each model is currently using can help us understand why some forecasts are more optimistic or pessimistic than others."" #COVID19 https://t.co/guMOjnhH4s",48466,4,IHME_UW,2020-05-20 05:00:00,10,['COVID19']
"On 5/21, our very own @AliHMokdad will join a virtual @CambiaGrove discussion surrounding payment &amp; incentive structures that other countries have deployed to deliver better health outcomes for individuals and populations.   Learn more and register here: https://t.co/wg64Xu4PD2",48466,1,IHME_UW,2020-05-20 03:00:00,4,[]
"""While many states’ decisions to reopen so soon increase the chances of a resurgence of COVID-19 in the United States, IHME hopes that these forecasts can help policymakers keep their states as healthy as possible,"" says IHME Professor @AliHMokdad. https://t.co/SsM2VMrd9Q",48466,5,IHME_UW,2020-05-20 01:00:00,8,[]
https://t.co/YQje09X82r https://t.co/MmKfschOPM,48466,5,IHME_UW,2020-05-20 00:11:59,8,[]
"b'#TDLaguna Pico de Covid-19 en M?xico ser? el 4 de agosto, seg?n IHME????? https://t.co/RswS5631EV'",48466,3,IHME_UW,2020-05-19 23:58:50,0,['TDLaguna']
b'Leading modeler IHME reduces its projection for total COVID deaths https://t.co/1XmXRMROle',48466,6,IHME_UW,2020-05-19 23:57:45,0,[]
"b'Woldmeter https://t.co/fn8oFFR05b informa, en los ultimos 6 d?as se han registrado 33 mil muertes en el mundo X #COVID19 10 mil en EUA, 5 mil en Brasil, 2.7 mil en Reino Unido y 1.7 mil en M?xico (60% del total), Casi 300 diarias. Si se registrar?n todas, M?xico ser?a 3er lugar https://t.co/THn3HcqWPh'",48466,11,IHME_UW,2020-05-19 23:14:35,0,[]
b'Here is how Americans are doing when it comes to wearing masks in public. We @IHME_UW use this data for our #Covid_19 projections. Wear your mask and do your part to crush the curve. https://t.co/ycANFR0CJV',48466,31,IHME_UW,2020-05-19 18:55:37,0,['Covid_19']
b'Thank you @DefeatDD for highlighting our diarrhea mapping work! The estimates from @IHME_UW show areas where disparities persist.   #nutrition #wash #DefeatDD   https://t.co/DTd7JIABuX',48466,1,IHME_UW,2020-05-19 17:10:40,0,[]
b'A study by a large group of scientists  -- @ICMRDELHI @thePHFI @IHME_UW  @somagnik  &amp; others -- has reported that 8.8% of all deaths in children under 5 ?? ?? were due to #AirPollution!   Full text: https://t.co/EIbZ5ApnXj   #IndiaAQ #AirPollution #MaternalChildHealth https://t.co/3tIw2H4y3n',48466,6,IHME_UW,2020-05-19 17:09:08,0,[]
"Are you looking at any environmental factors and addressing those in your #COVID19 model?  .@AliHMokdad: We're looking at temperature, and we've found that the effects of temperature on transmission are important, yet minimal.",48466,2,IHME_UW,2020-05-19 16:58:17,3,['COVID19']
"To hear more from @DrRafaelLozano about the ways the #COVID19 pandemic is impacting Latin America/#LATAM, check out his article for @ThinkGlobalHlth: https://t.co/jTak2m4Hr3",48466,4,IHME_UW,2020-05-19 16:53:03,2,"['COVID19', 'LATAM']"
"Why did your model change from a statistical model to a SEIIR model?   .@AliHMokdad: When we first started modeling the pandemic, we didn't know much about it besides what we understood from the mortality data. Now we know more, so we're working what we know into our model.",48466,1,IHME_UW,2020-05-19 16:44:37,3,[]
Now we're shifting to the Q&amp;A,48466,1,IHME_UW,2020-05-19 16:44:07,0,[]
b'Super interesante el webinar con los modelos del @IHME_UW para #Latam https://t.co/lWPowMGADe',48466,5,IHME_UW,2020-05-19 16:40:41,0,['Latam']
".@DrRafaelLozano: It's also important to look to the future and incorporate other types of control strategies that have to be added on to the model, like the use of masks, how to do contact tracing, and perhaps some digital tracing measures used in other countries. #COVID19",48466,1,IHME_UW,2020-05-19 16:40:24,3,['COVID19']
".@DrRafaelLozano: When it comes to #COVID19, we cannot just talk about the present. I understand that those managing the pandemic in different countries need to have data about how many hospital beds may be needed, as well as ventilators, etc... (continued)",48466,1,IHME_UW,2020-05-19 16:40:24,2,['COVID19']
.@DrRafaelLozano: Data transparency in countries is vital. A lack of transparency is a barrier to our analyses. #COVID19 https://t.co/zXOLQehe8v,48466,6,IHME_UW,2020-05-19 16:36:40,4,['COVID19']
.@DrRafaelLozano: If #BajaCalifornia relaxes social distancing... it could have major consequences in terms of infections and deaths. The hospital system is already at capacity. https://t.co/MLWsHevr5y,48466,1,IHME_UW,2020-05-19 16:31:45,0,['BajaCalifornia']
"""80,000 deaths in Brazil by August 4 with 8 states considered in our model. São Paulo may have 36,000 deaths. There may be a severe lack of ICU beds in the state."" - @DrRafaelLozano https://t.co/rV7scQZyvC",48466,4,IHME_UW,2020-05-19 16:30:48,0,[]
"""What are the main differences between modeling for the US and Latin America? There have been substantial data limitations from countries and lack of reporting of mortality."" - @DrRafaelLozano https://t.co/kWhAZ0FE6G",48466,3,IHME_UW,2020-05-19 16:27:13,2,[]
"""Here are the current countries we are modeling for."" - @DrRafaelLozano https://t.co/9ARccaP9FZ",48466,1,IHME_UW,2020-05-19 16:24:51,1,[]
"""What can happen if we ease social distancing too early? There is much uncertainty and discussion on what must be done."" - @DrRafaelLozano https://t.co/0wFUlBDIMB",48466,2,IHME_UW,2020-05-19 16:20:59,1,[]
"For more information about our #COVID19 model methods, view our update blog »https://t.co/4JtWx3gGu0 https://t.co/QcLAim8OsW",48466,2,IHME_UW,2020-05-19 16:19:54,1,['COVID19']
"""What makes this complex is how we add information to our model. Changes in temperature affect the model as well as population density, mobility, and a country's ability to measure and identify bias in how we identify cases."" - @DrRafaelLozano https://t.co/tbULD2aEat",48466,3,IHME_UW,2020-05-19 16:18:44,0,[]
"“This is the fourth generation of our model, an SEIIR model.” - @DrRafaelLozano https://t.co/VkD0sMYK4L",48466,3,IHME_UW,2020-05-19 16:16:54,0,[]
Heads up that we're now live tweeting @DrRafaelLozano and @AliHMokdad's discussion with @the_IDB on our recent #COVID19 forecasts for #LatinAmerica and the #Caribbean. https://t.co/WR4pjKvd6e,48466,2,IHME_UW,2020-05-19 16:13:40,8,"['COVID19', 'LatinAmerica', 'Caribbean']"
"View projections of mobility, daily deaths, total deaths, and hospital resource use for the US, European Economic Area countries, Latin America, and other countries in our COVID-19 data visualization. https://t.co/YQje09X82r",48466,5,IHME_UW,2020-05-19 11:00:00,5,[]
There is still time to register for the #COVID19 webinar from @the_IDB featuring @IHME_UW's own @DrRafaelLozano and @AliHMokdad. Register for the webinar: https://t.co/Epcjxpp4rb https://t.co/qciSbpNmAD,48466,3,IHME_UW,2020-05-19 09:00:01,3,['COVID19']
"b""We know we're biased, but our Dean @Hilary_A_Godwin is pretty amazing. Exhibit A: This video clip ? of her discussing mask snorkels? Thanks @KiyomiTaguchi @uwnews for covering such an important topic! https://t.co/sxJxakLo5I""",48466,3,IHME_UW,2020-05-19 06:40:53,0,[]
"b""One out of four people in the world didn't have access to proper hand-washing facilities in 2019. If we want to successfully combat #COVID, this needs to change.  #FlattenTheCurve #Pandemic #Response https://t.co/cmgQnVvUH6""",48466,5,IHME_UW,2020-05-19 06:39:49,0,[]
"b'.@IHME_UW just released our new #COVID19 projections, a decline to 143,357 projected deaths by August 4th. The data on wearing masks explains the association between increased mobility and infection. Wear a mask and keep a safe distance to crush the curve. https://t.co/8Dtjs8IYFS'",48466,19,IHME_UW,2020-05-19 06:38:24,0,['COVID19']
"b""We've launched a #COVID19 recovery research grant program to support @UW, @UWBothell, and @uwtacoma researchers to respond to the vast array of economic-related challenges created by the pandemic. Awards of $20k. https://t.co/xDPjOADRzb #PopulationHealth""",48466,7,IHME_UW,2020-05-19 06:38:08,0,['COVID19']
"b'I practice what I preach. I wear a mask to protect others from me, I keep a safe distance to protect myself from others. Wearing a mask and keeping a safe distance will crush the #covid19 curve. @IHME_UW @KateBolduan @UW  let us all do our part. https://t.co/PtXRQ17PmP'",48466,10,IHME_UW,2020-05-19 06:37:47,0,[]
"b'#PorSiNoLoLe?ste | El Instituto de Medici?n y Evaluaci?n de la Salud (@IHME_UW) de la Universidad de Washington (@UW), hizo el pron?stico de que en #M?xico habr?a 6 mil 859 muertes para el 4 de agosto por la sepa del coronavirus SARS- CoV-2.  https://t.co/d3CWczD7bZ'",48466,5,IHME_UW,2020-05-19 06:27:11,0,['PorSiNoLoLeíste']
"""In 2017, lack of access to handwashing was linked to a total of 707,000 deaths globally... #Ethiopia is one of the eight countries in which more than fifty million people lacked access to handwashing in 2019."" (via @ThinkGlobalHlth) #COVID19 https://t.co/z08xLel1Ha",48466,10,IHME_UW,2020-05-19 05:00:00,15,"['Ethiopia', 'COVID19']"
"""Comparing the rate that new cases are growing in states that implemented a statewide closure of non-essential business to the rate in those that didn't provides some evidence that social distancing is helping to flatten the curve more quickly."" Read more: https://t.co/kHALjxVcFq",48466,12,IHME_UW,2020-05-19 05:00:00,17,[]
"b'The latest @IHME_UW coronavirus model is in, and the results surprised IHME director Chris Murray, who said mask-wearing might be having a noticeable impact on the spread of the virus: https://t.co/78N0jHd8JA'",48466,18,IHME_UW,2020-05-19 02:41:37,0,[]
"Ecuador is projected to have 5,215 #COVID19 deaths by August. We are using a different approach for Ecuador that considers all-cause mortality since the number of reported deaths due to COVID-19 appears to be improbably low. View projections for Ecuador: https://t.co/ufeEv7I43B https://t.co/dMZaFQKeuB",48466,11,IHME_UW,2020-05-19 01:00:01,6,['COVID19']
"""If testing can’t keep pace with the number of infections in the community, it will be very easy for coronavirus infections to increase,"" says IHME Professor @AliHMokdad. #COVID19 (via @ThinkGlobalHlth)  https://t.co/SsM2VMrd9Q",48466,5,IHME_UW,2020-05-18 21:00:00,11,['COVID19']
b'Check out how our #covid19 @IHME_UW @UW @UWMedicine projections are helping policymakers navigate the COVID-19 pandemic ? and prepare for an uncharted future. https://t.co/wRiU6B9CbV',48466,5,IHME_UW,2020-05-18 20:44:34,0,['covid19']
"b'We asked one of our campus photographers to share some of the memorable photos he?s taken this spring during the pandemic, and to describe what it?s like working on campus now.  Read more and see more photos: https://t.co/VpCV4Ei6BG https://t.co/e83EO7R6yf'",48466,23,IHME_UW,2020-05-18 20:07:04,0,[]
"b'States can use @IHME_UW tool to monitor changes in mobility to understand what additional measures may be needed to control disease transmission, says @AliHMokdad  in @ThinkGlobalHlth. https://t.co/LlZ7iBvihK'",48466,5,IHME_UW,2020-05-18 19:40:23,0,[]
"""Though earlier revised projections suggested there would be fewer deaths during the first wave of COVID-19 infections, on May 4 IHME once more made a sobering adjustment.""  Learn more about our 5/4 estimate update in the story below: https://t.co/oTm1RS8hPq",48466,2,IHME_UW,2020-05-18 19:38:05,1,[]
"""Models don’t predict the future — they help us prepare for it."" https://t.co/zA43MsaGYj",48466,1,IHME_UW,2020-05-18 19:38:05,3,[]
"""Throughout the pandemic, and in response to critiques of the model, IHME has been open about the methodology used, the challenges of projecting an unprecedented event like COVID-19...""",48466,1,IHME_UW,2020-05-18 19:38:04,0,[]
"""By detailing the number of current cases and projecting when they’re expected to spike, the IHME model has been informing crucial policy decisions that, according to @washingtonpost, may have saved thousands of lives."" https://t.co/0kVQt0jjnf",48466,1,IHME_UW,2020-05-18 19:38:03,0,[]
"""The model, which would revise its projections as the pandemic unfolded, provides state, national and international COVID-19 data.""  https://t.co/YQje09FwDR",48466,1,IHME_UW,2020-05-18 19:38:03,0,[]
"“Modeling a pandemic is a bit like hurricane tracking,” says @UW Professor of Health Metrics Sciences @AliHMokdad, “but instead of modeling for just one geographic region, you’re doing it for much of the world.” https://t.co/8Q0qthsrVn",48466,1,IHME_UW,2020-05-18 19:38:03,1,[]
"Read the full @UW story blow. In this thread, we're going to highlight a few parts of it.  https://t.co/j1DhXUDFGn",48466,1,IHME_UW,2020-05-18 19:38:02,0,[]
".@UW featured us on the homepage, »https://t.co/pMrDBjnRUa!   ""Data modeling may have been unfamiliar to most of us before the COVID-19 pandemic, but it’s now front-and-center in the national conversation."" https://t.co/UevBI9nnFM",48466,9,IHME_UW,2020-05-18 19:38:01,15,[]
"b""When the #COVID19 shutdown began, traffic in Seattle dropped 54%. It's now rebounded to around 35% below pre-COVID-19 levels. @AliHMokdad of @IHME_UW warns that as people start to move around again, the virus will continue to circulate.  https://t.co/7WPH4RGF7c https://t.co/H3RlXcLbFx""",48466,6,IHME_UW,2020-05-18 17:55:49,0,['COVID19']
Join @AliHMokdad and @DrRafaelLozano tomorrow for a discussion with @the_IDB on our recent #COVID19 forecasts for Latin America and the Caribbean. Register here: https://t.co/ovjOn8rBwR https://t.co/99edTgMQxw,48466,4,IHME_UW,2020-05-18 17:30:01,4,['COVID19']
"Want to know more about our COVID-19 model? Visit our FAQ to learn more about why numbers change, how we measure social distancing, our new modeling approach, and more. https://t.co/YjPzAS8NLB https://t.co/oeaBbDJpLg",48466,2,IHME_UW,2020-05-18 15:00:02,7,[]
"On May 21, @AliHMokdad will join Dena Morris and Dr. Albert Wettstein for a discussion surrounding how #healthcare is paid for in other countries and what we can learn from them to help improve our outcomes domestically. Register today: https://t.co/wg64Xu4PD2",48466,2,IHME_UW,2020-05-18 11:00:00,3,['healthcare']
"Download projections of daily deaths, total deaths, and hospital resource use for the US, European Economic Area countries, Latin America, and other countries used in our COVID-19 data visualization. https://t.co/YsRSeQGhIe https://t.co/7dt6gsuOff",48466,6,IHME_UW,2020-05-18 03:00:01,10,[]
South Korea’s success in #COVID19 testing was evident as they scaled up testing during the peak of the epidemic and have maintained high levels as the epidemic continues. View projections for South Korea: https://t.co/j3qYbXYzxx https://t.co/LZkQZAXu7H,48466,4,IHME_UW,2020-05-17 23:00:01,5,['COVID19']
How do other national health systems respond to crises? What are key takeaways from past and current experiences that we can use to rebuild the health care system? Join @AliHMokdad on 5/21 for a virtual discussion with @CambiaGrove: https://t.co/wg64Xu4PD2,48466,5,IHME_UW,2020-05-17 23:00:00,3,[]
"What’s in development for our COVID-19 model? We’re working on new projections for additional countries and adding new key epidemic drivers, including the use of face masks and human contact rates. Details: https://t.co/cK0AAOSi9Z https://t.co/xp9v0J3eZm",48466,6,IHME_UW,2020-05-17 11:00:01,6,[]
"Join @AliHMokdad for Part 1 of the @CambiaGrove Paying for Health series, discussing payment &amp; incentive structures that other countries have deployed to deliver better #health outcomes for individuals &amp; populations. Sign up here: https://t.co/wg64Xu4PD2",48466,2,IHME_UW,2020-05-16 23:00:00,1,['health']
@madhavjee We are prioritizing projections for countries that have &gt;50 COVID-19 deaths.,48466,1,IHME_UW,2020-05-16 15:14:10,0,[]
"Have questions about our COVID-19 projections? Visit our FAQ to learn more about the project, data sources, and how we’re modeling the outbreak. https://t.co/YjPzAS8NLB https://t.co/L3PUH4WZU3",48466,2,IHME_UW,2020-05-16 15:00:02,5,[]
b'Identifying communities with high disease burden can help policymakers target investments. Estimates can help: https://t.co/PMgjAhFdQ3  #DefeatDD @IHME_UW',48466,2,IHME_UW,2020-05-16 14:48:29,0,[]
b'This will be the first of a great series of events through @CambiaGrove. Join us virtually for this discussion. #healthcareincentives https://t.co/huzkYh7Yn2',48466,1,IHME_UW,2020-05-15 23:20:36,0,[]
b'The @IHME_UW research center produces updated health forecasts on the #coronavirus in different countries. Learn about its projections for Latin America and the Caribbean: https://t.co/z8eFdXLMpw. https://t.co/d2meWxbjIq',48466,2,IHME_UW,2020-05-15 22:56:21,0,['coronavirus']
"b'Join Cambia Grove on 5/21 to examine how other countries pay for health with former @WGHA President, Dena Morris, Chief Strategy Officer at @IHME_UW, @AliHMokdad, and former Public Health Official in Zurich, Dr. Albert Wettstein. Event registration here: https://t.co/FzP5KZLYsl'",48466,2,IHME_UW,2020-05-15 22:56:17,0,[]
"What’s in development for our #COVID19 model? We’re working on new projections for additional countries and adding new key epidemic drivers, including the use of face masks and human contact rates. Details: https://t.co/cK0AAOSi9Z https://t.co/gVeL5fAKnj",48466,3,IHME_UW,2020-05-15 21:00:02,8,['COVID19']
We strongly agree that decision-makers should draw on a diversity of COVID-19 models. We’re committed to scientific debate and constant improvement of our predictions. Learn more: https://t.co/YjPzAS8NLB https://t.co/qPse43Jdab,48466,2,IHME_UW,2020-05-15 19:00:02,4,[]
"In addition to several Latin American countries, we added eight new countries in our May 12 release. Among these, Turkey is projected to have the highest total #COVID19 deaths at 5,263 deaths. View these projections and more: https://t.co/coCDlIQgh4 https://t.co/NickKx1pNO",48466,7,IHME_UW,2020-05-15 18:00:02,1,['COVID19']
"Join @AliHMokdad for Part 1 of the @CambiaGrove Paying for Health series, discussing payment &amp; incentive structures that other countries have deployed to deliver better #health outcomes for individuals &amp; populations. Sign up here: https://t.co/wg64Xu4PD2",48466,5,IHME_UW,2020-05-15 13:00:02,7,['health']
"New national estimates project Colombia will have 2,157 (793 to 5,890) COVID-19 deaths by August. Death projections, mobility and social distancing measures, and hospital resource use is available in our data visualization: https://t.co/q5B5Y6ZWv1 https://t.co/0CvaYk2veX",48466,6,IHME_UW,2020-05-15 05:00:01,5,[]
b'How have ICUs changed in response to @COVID19? @KiraNewmanMDPhD @UWMedicine @UWDeptMedicine is among those interviewed by @NPRjonhamilton @NPRHealth She comments on protective procedures necessary in placing a breathing tube https://t.co/53cCegXN2H',48466,4,IHME_UW,2020-05-15 04:58:00,0,[]
b'.@IHME_UW?s latest #COVID19 tool provides insight on the several new indicators - in addition to death estimates through 8/4 - to offer information to support states with their reopening plans. Follow for details. 1/9 https://t.co/juOChZQ0yU',48466,9,IHME_UW,2020-05-15 04:42:56,0,['COVID19']
"Ecuador is estimated to have 5,215 (4,844 to 6,052) COVID-19 deaths by August according to our latest #COVID19 forecasts. View more results for Ecuador in our visualization tool: https://t.co/ufeEv7I43B https://t.co/KUtLdyuNZu",48466,3,IHME_UW,2020-05-15 03:00:01,4,['COVID19']
@JorgePontual https://t.co/FeLacPrxeG,48466,0,IHME_UW,2020-05-15 00:58:56,0,[]
b'#Video ? El Institute for Health Metrics and Evaluation (IHME) de la Universidad de Washington prev? casi 7 mil muertes de Covid-19 en M?xico https://t.co/BorGHueFCc https://t.co/fIRWMIoQ9a',48466,16,IHME_UW,2020-05-15 00:57:29,0,['Video']
b'El Institute for Health Metrics and Evaluation public? su previsi?n de los estados mexicanos que registrar?n m?s muertes por COVID-19 de aqu? a agosto. Tabasco ocupar?a el tercer lugar nacional con m?s decesos por coronavirus en el pa?s. https://t.co/Sa311GeU3Q',48466,7,IHME_UW,2020-05-15 00:57:24,0,[]
"b""So what's the undercount on #covid19 in the US? I worked with @Harvard statistician @rafalab to calculate the excess deaths, and it seems that in the US more than 100,000 Americans have ALREADY died from the coronavirus. Here's our count: https://t.co/abwkI3in38""",48466,1292,IHME_UW,2020-05-15 00:54:44,0,['covid19']
b'Estiman que el pico de la pandemia podr?a extenderse hasta 7 de junio. #Covid_19   https://t.co/YL9PWZe5a0',48466,17,IHME_UW,2020-05-15 00:42:50,0,['Covid_19']
"b'Te invito al seminario que organiza @the_IDB el Martes 19 sobre la aplicacion del modelo COVID-19 de @IHME_UW en 9 pa?ses de Am?rica Latina, comparitemos con el Prof. @AliHMokdad inscr?bete en https://t.co/isQwtnYz35 https://t.co/AcSK8qYo7Y'",48466,21,IHME_UW,2020-05-15 00:39:05,0,[]
"A new study in @EClinicalMed, published by @TheLancet, maps trends in child stunting, wasting, and underweight in India between 2000 and 2017. Read the #openaccess study online: https://t.co/9gG7cQEU5Y https://t.co/gp1tWAD1s0",48466,2,IHME_UW,2020-05-14 23:00:01,4,['openaccess']
b'join @IHME_UW @DrRafaelLozano @the_IDB webinar on #COVID19 to find out about the latest projections for Latin America.  https://t.co/97zNPwgAuo',48466,3,IHME_UW,2020-05-14 22:53:58,0,['COVID19']
