Good news! https://t.co/5o6MwI8PBh,172477,1,JohnsHopkins,2019-03-06 21:02:06,17,[]
b'Breaking News: @JohnsHopkins Student Center!!!!!!!! ? https://t.co/vbbhqPpxAY',172477,4,JohnsHopkins,2019-03-06 03:52:43,0,[]
b'Another big announcement tonight! Congrats @JohnsHopkins and thank you to our dedicated alumni and trustees. We?re on a roll #BlueJays #gohops https://t.co/kC73DS5DzS',172477,5,JohnsHopkins,2019-03-06 03:52:38,0,[]
Phage Phun. https://t.co/HOlg8hlYNO,172477,0,JohnsHopkins,2019-03-06 03:40:36,13,[]
b'Could Bruce Willis have saved us if the #asteroid in Armageddon were stronger and harder to break?? Check out this new research from @JHU_HEMI @HopkinsEngineer that looks at how tough an asteroid is to break https://t.co/6Pg4kNUBGr https://t.co/45ZtbriY7m',172477,4,JohnsHopkins,2019-03-06 03:39:22,0,['asteroid']
#GoHop! https://t.co/RbyBOPIdDf,172477,0,JohnsHopkins,2019-03-06 02:19:59,11,['GoHop']
"Congratulations to the two latest inductees into the Indispensable Role of Blacks at JHU exhibit. Learn more about Ivor James Benjamin and Barbara Bates Hopkins, and their life's work, here: https://t.co/eCojCC1KBA https://t.co/nqUYwKqoa5",172477,1,JohnsHopkins,2019-03-05 14:12:01,10,[]
"Public health experts condemn 'dangerous' research funded by the U.S. government to create airborne versions of highly infectious diseases.  ""The government confirmed them only when a reporter learned about them through non-official channels.""  https://t.co/pQ1QUuDpAa https://t.co/uBhuCGagfE",172477,4,JohnsHopkins,2019-03-05 06:41:01,7,[]
"b'""I see a lot of what goes on in global health this way: proponents engaged in an effort to alter the way we perceive the world, and by doing that, they change what\'s possible,"" says Jeremy Shiffman, one of the newest @JHU_BDPs at @JohnsHopkins. https://t.co/FpLsjZwWdj'",172477,7,JohnsHopkins,2019-03-05 02:10:51,0,[]
"“A lot of the information we teach doesn’t stick,” @MarialeHardiman, a professor at @JHUEducation, tells the @nytimes.   Teachers told her “the children would remember the information better when they taught it through the arts.”   #neuroeducation #neuroscience #learning https://t.co/9WBLkeVLeh",172477,1,JohnsHopkins,2019-03-05 02:10:40,6,"['neuroeducation', 'neuroscience', 'learning']"
"b'CBID Exec Director Dr Youseph Yazdi presenting @SXSWEDU this week in Austin, about how the @AspenInstitute Stevens Initiative has brought student @JohnsHopkins and the Middle East together to design health solutions. https://t.co/RLi8xJr5a1'",172477,13,JohnsHopkins,2019-03-05 02:03:46,0,[]
"Congressional report outlines a path for reducing child poverty in the U.S.   ""Child poverty is actually very expensive for our country,"" Johns Hopkins economist Robert Moffitt tells The Hub. #poverty https://t.co/GKIzarPQg4 https://t.co/KE6Lyq6xA7",172477,3,JohnsHopkins,2019-03-05 01:10:01,10,['poverty']
b'Breaking up is hard to do: NEW research from @JHU_HEMI @HopkinsEngineer found that #asteroids are stronger &amp; harder to break than previously thought. This info could help aid the @NASA DART (Double Asteroid Redirection Test) mission #space https://t.co/VNiqG5vZB7 https://t.co/5nBXbbLKmq',172477,16,JohnsHopkins,2019-03-05 00:36:07,0,['asteroids']
Congrats for the nomination! https://t.co/2lkD39lVht,172477,0,JohnsHopkins,2019-03-05 00:04:51,3,[]
Men's lacrosse: Hopkins gets even with come-from-behind win at Princeton. #GoHop! https://t.co/pU5ULBOAGj,172477,0,JohnsHopkins,2019-03-04 23:09:00,7,['GoHop']
"Breaking up is hard to do: Asteroids are stronger, harder to destroy than previously thought https://t.co/jXDpKqn48y https://t.co/WgfP1bisRk",172477,3,JohnsHopkins,2019-03-04 16:44:01,4,[]
"Weather and campus operations update for today, Sunday, March 3rd. Click here for full details —&gt; https://t.co/Dxx5xG5zKK https://t.co/l0p4nUKljl",172477,2,JohnsHopkins,2019-03-03 18:35:41,3,[]
"b""If classical music is to survive, it must embrace diversity now, @fredbronstein of @JohnsHopkins' @george_peabody writes in @BaltimoreSun: https://t.co/sDzCC90wAm""",172477,7,JohnsHopkins,2019-03-02 12:08:23,0,[]
b'Look at this list of speakers! Join #SNFAgora and @renew_democracy on 3/13-3/14. @BillGalston @Yascha_Mounk @BillKristol @MaxBoot @JRubinBlogger @Peter_Wehner @Yamiche @JonHaidt @Kasparov63 @anneapplebaum @edwardlucas @BretStephensNYT @SenatorCardin @EricCantor and many more.',172477,22,JohnsHopkins,2019-03-01 21:27:52,0,['SNFAgora']
b'@JohnsHopkins this morning vs. @JohnsHopkins on a balmy February afternoon two weeks ago --- each is fun in its own way. https://t.co/cU35KR6JG0',172477,1,JohnsHopkins,2019-03-01 21:25:27,0,[]
@kristyn_sylvia Hello - Thank you for bringing this to our attention. Can you DM us more information so we can follow up and forward more information to our Transportation Dep't. Thanks.,172477,0,JohnsHopkins,2019-03-01 17:00:18,0,[]
b'How can the U.S. reduce child poverty? @JohnsHopkins economist @ramoffitt3 contributed to the just-released national report. https://t.co/STltiXuymZ via @HubJHU',172477,9,JohnsHopkins,2019-03-01 14:33:44,0,[]
"b'Our application deadline for fall 2019 transfer admission is tomorrow, March 1. Learn more: https://t.co/TrcCIh9HLo'",172477,3,JohnsHopkins,2019-03-01 12:45:47,0,[]
"b""You will receive training to help you craft your scientific message for this amazing event.   That's right...a #scicomm training opportunity!!!    Apply! Apply! Apply! https://t.co/y2x524DAqg  @JohnsHopkinsEPI @JohnsHopkinsSPH  @JohnsHopkins https://t.co/uUuo15pYAe""",172477,7,JohnsHopkins,2019-03-01 12:43:03,0,['scicomm']
b'.@SAIS_MAGP kicked off our international negotiation simulation yesterday at @JohnsHopkins in Baltimore!  Learn more about our residencies and unique curriculum here: https://t.co/nSqCkr1Smr https://t.co/B5wRqRFezn',172477,5,JohnsHopkins,2019-03-01 12:42:13,0,[]
b'. # BlackHistoryMonth and I celebrate Dr.Solomon Carter Fuller who worked in the lab with Alois Alzheimer?s and is an early pioneer of Alzheimer?s research.His wife acclaimed artist Meta Vaux Warrick Fuller. We stand on shoulders of giants.@JHU_Alumni @EndAlZ @LEAD_Coalition https://t.co/R7ZWONMeFS',172477,5,JohnsHopkins,2019-03-01 10:16:34,0,[]
b'Henderson-Hopkins School celebrates Black History Month with storytelling night https://t.co/y19p2HJ2Bh via @HubJHU',172477,2,JohnsHopkins,2019-03-01 03:09:37,0,[]
"b'Bloomberg Professors on Twitter also include: Felipe Campante @FilipeCampante, Rachel Green @GreenLabJHMI, Carol Greider @CWGreider, TJ Ha, Rick Huganir @rhuganir, Patricia Janak @JanakLab, Rong Li @RongLiLab, Ellen McKenzie @EllenJMacKenzie, Stephen Morgan @SLMsociology. ...2/3 https://t.co/pvi5VYcKdk'",172477,6,JohnsHopkins,2019-03-01 03:08:56,0,[]
"b'Many of our @JohnsHopkins Bloomberg Distinguished Professors are on Twitter.  They include: Profs Lisa Cooper @LisaCooperMD, Jess Fanzo @jessfanzo, Steven Salzberg @StevenSalzberg1, Mike Shatz @mike_schatz, Nilanjan Chatterjee @nilanjan10c, Arturo Casadevall @ACasadevall1, ...1/2 https://t.co/vOXj6o5Ucr'",172477,5,JohnsHopkins,2019-03-01 03:08:53,0,[]
"b'Researchers at @JohnsHopkins @HopkinsEngineer have developed a new method of increasing the reactivity of ultrathin nanosheets, just a few atoms thick, that could make fuel cells for hydrogen cars less expensive. https://t.co/pOAXL1UL5j'",172477,3,JohnsHopkins,2019-03-01 03:08:30,0,[]
b'Our @JohnsHopkins Bloomberg Distinguished Professors on Twitter also include Profs Sabine Stanley @PlanetSabine and Vesla Weaver @VeslaWeaver! https://t.co/kQddeEu43p',172477,6,JohnsHopkins,2019-03-01 03:08:13,0,[]
This @CityLab story covers the latest Hopkins research on students commuting to school through high-crime areas.   What kind of effects does living in and traveling through such an environment have on them?  https://t.co/nMMl52C2Nr,172477,3,JohnsHopkins,2019-02-28 21:28:37,7,[]
b'A warm welcome and congrats to the families of our early decision admits @JohnsHopkins. The journey begins #GoHop https://t.co/eRAmyJ81Kc',172477,2,JohnsHopkins,2019-02-28 05:31:27,0,['GoHop']
#GoHop! https://t.co/AJXfk2SrvL,172477,3,JohnsHopkins,2019-02-28 02:31:45,7,['GoHop']
Great news. We’ll be sure to add them to our Twitter List of Hopkins Profs. https://t.co/JzQ0xlmZxD,172477,1,JohnsHopkins,2019-02-28 02:31:24,7,[]
"b'The 2nd Hopkins on the Hill will be held on June 12th in the House of Representatives. Are you an early-career, federally funded researcher or practitioner? Apply to present at the event! Photos from the inaugural event in 2017 #scicomm #HopkinsHill2019 https://t.co/XKwYFSIBYe https://t.co/f8q1xNPvOA'",172477,12,JohnsHopkins,2019-02-28 02:29:42,0,[]
"b'Of course she did! ?Oscar-winning songwriter @ladygaga graduated from @CTYJohnsHopkins, a prestigious program for gifted children. ? https://t.co/cfeVQka9w8 via @baltimoresun'",172477,31,JohnsHopkins,2019-02-28 02:29:05,0,[]
"b'Live at @JohnsHopkins @JHUAPL @JHUPress @mselibrary Come meet Dr. Patricia Ann Straat, #Viking #Mars Mission #Biologist. Hear her first hand experience on the 1976 mission.  #NASA #Astrobiology #Autobiography #AerospaceHistory https://t.co/myWfOxfbjz'",172477,1,JohnsHopkins,2019-02-27 00:14:11,0,"['Viking', 'Mars', 'Biologist']"
"b""NYT feature about work by @JohnsHopkins Prof. Marc Kamionkovski  and colleagues.   They provide the first working model to explain a discrepancy between @JHU_BDPs Adam Riess' measurements of the cosmic expansion rate and @JHU_BDPs Chuck Bennett's' WMAP measurement. https://t.co/OP56cqirVE""",172477,5,JohnsHopkins,2019-02-27 00:13:54,0,[]
Peter Frampton Says He Has Degenerative Muscle Disease and Announces Farewell Tour.   $1 from every ticket sale on the coming tour would go toward a fund he started with Johns Hopkins University to research myositis.  https://t.co/RRua5KN07i,172477,7,JohnsHopkins,2019-02-26 16:44:00,15,[]
A classic space gets a big makeover. Very excited for future events here:   A look inside the new and improved Shriver Hall. https://t.co/zqqV3M18yu https://t.co/frxIIINOHU,172477,0,JohnsHopkins,2019-02-26 14:12:01,17,[]
Spaghetti structures with marshmallow mortar?  Whiting School of Engineering hosts annual Tower of Power competition --&gt; https://t.co/b2jIsqgqTJ https://t.co/ypTwlqRuKP,172477,0,JohnsHopkins,2019-02-26 06:41:01,12,[]
Yasss!  Men's lacrosse: Hopkins hangs on for key win at No. 10 North Carolina  #GoHop https://t.co/2TPfaYwnhH https://t.co/KPc1d4D5Ct,172477,0,JohnsHopkins,2019-02-26 01:10:01,11,['GoHop']
Attention faculty!  Call for nominations: 2019 Provost's Prize for Faculty Excellence in Diversity https://t.co/68kutPwjdH https://t.co/2bPysEtjSw,172477,0,JohnsHopkins,2019-02-25 23:09:01,5,[]
Johns Hopkins Day at the Reginald F. Lewis Museum drew a crowd.   The Black History Month celebration offered free admission to the museum for all Hopkins affiliates and their families https://t.co/qQhp51NNJb https://t.co/NZ0q5A5W3P,172477,0,JohnsHopkins,2019-02-25 16:44:01,6,[]
"b'A survey analysis by @LivableFuture\'s @RNeff1, @HarvardFLPC, and @NCL_tweets finds that misunderstanding of food ""Best By"" or ""Use By"" labels is linked with higher food discards. https://t.co/Z3nkLeIsgj'",172477,9,JohnsHopkins,2019-02-23 13:38:08,0,[]
Busy week for new-look Jay. Hope Jay brought some smiles at @HopkinsKids! #GoHop https://t.co/RRCLuNCSsx,172477,2,JohnsHopkins,2019-02-22 23:02:57,10,['GoHop']
"Congratulations, Coach Chimera! https://t.co/8NgWdBBbRp",172477,1,JohnsHopkins,2019-02-22 22:07:25,11,[]
"Per @BaltimoreSun: ""#JohnsHopkins exceeds goals for supporting local businesses, hiring #Baltimore"" via #HopkinsLocal:  https://t.co/1t344HIdN7",172477,3,JohnsHopkins,2019-02-22 19:56:36,11,"['JohnsHopkins', 'Baltimore', 'HopkinsLocal']"
"b""Taking your calls now! John's Hopkins Children's Miracle Network 410-823-1065 @HopkinsMedicine @JohnsHopkins @HopkinsKids @Mix1065FM @remax #iamfreedomchurch https://t.co/AqOxcVTyHL""",172477,2,JohnsHopkins,2019-02-22 16:51:15,0,[]
Thanks! https://t.co/OwZNF17g36,172477,2,JohnsHopkins,2019-02-22 15:55:24,11,[]
New-look Jay is definitely making the rounds this week. https://t.co/Tc0D3XJWeY,172477,0,JohnsHopkins,2019-02-22 15:05:45,1,[]
"b'The Maryland Innovation Initiative is due on March 1! #Startups that have licensed technology from @JohnsHopkins are eligible to up to $265,000 for both the Technology Assessment &amp; Company Formation phases of the program. https://t.co/4ouGqUczIp https://t.co/veARM04CEo'",172477,5,JohnsHopkins,2019-02-22 15:00:52,0,['Startups']
b'Fourth-year PhD student John Rattray shared the best thing he?s learned as an engineer as part of our #EWeek2019 celebrations! #HopkinsEngineer https://t.co/0e0L7EidhX',172477,8,JohnsHopkins,2019-02-22 15:00:31,0,['EWeek2019']
b'Happy 143rd birthday @JohnsHopkins! Join us on the Q-level of the @mselibrary from noon to 2 p.m. today (Feb. 22) to celebrate with cupcakes. ??? https://t.co/RNNExkEtyY',172477,6,JohnsHopkins,2019-02-22 14:45:39,0,[]
"b'""The impact of HopkinsLocal has surpassed our hopes, and we are thrilled by the difference it is making in Baltimore and in our neighbors\' lives and on their businesses, as well as on our institution."" - Ronald J. Daniels, President @JohnsHopkins https://t.co/bpue4cvjcb https://t.co/ex6514a4iH'",172477,2,JohnsHopkins,2019-02-22 14:26:22,0,[]
Thanks! https://t.co/95FLNduubO,172477,7,JohnsHopkins,2019-02-22 14:25:57,32,[]
b'Erratic video-streaming on the internet is annoying. For some applications?like remote robotic surgery?the wait can be downright dangerous. #HopkinsEngineer Amy Babay is working to solve that problem.  Read more: https://t.co/8CL71YQsV1 #GirlDay2019 https://t.co/MD9GTCcQ56',172477,6,JohnsHopkins,2019-02-22 04:33:40,0,[]
Fantastic news. https://t.co/TNYV62MZyC,172477,5,JohnsHopkins,2019-02-22 02:27:58,52,[]
"b'Johns Hopkins surpasses its three-year goals to build, hire, and buy locally https://t.co/HuS8xnPOq1 via @HubJHU'",172477,4,JohnsHopkins,2019-02-22 02:27:00,0,[]
"b'Heart attack victims? chances of survival drop 7-10% with every minute that passes without CPR and defibrillation. Register for your American Red Cross CPR/AED and Standard First Aid certification class on February 25th, Monday 7-10pm. Be prepared to save a life! #JHURec https://t.co/u8Lo3721bF'",172477,7,JohnsHopkins,2019-02-22 02:26:55,0,[]
b'.@JohnsHopkins among 40 sites across the country to test a new Alzheimer?s drug. https://t.co/lgnN8GdCiM',172477,7,JohnsHopkins,2019-02-21 18:09:23,0,[]
"b'Some news: @JohnsHopkins has surpassed its three-year goals for hiring, purchasing and construction contracting in Baltimore. https://t.co/7bHm4o4MbO https://t.co/LlQzgkaYui'",172477,7,JohnsHopkins,2019-02-21 17:17:30,0,[]
"b'Johns Hopkins says it has surpassed its three-year goals to build, hire and buy locally https://t.co/F7NqrKVpUj   Increased spending with Baltimore businesses by more than $54 million, and made 1,017 new hires from targeted ZIP codes. @JohnsHopkins #Baltimore'",172477,4,JohnsHopkins,2019-02-21 15:18:51,0,[]
"In 2015, Johns Hopkins set goals to increase economic opportunity in Baltimore City through targeted spending on construction, hiring and purchasing from local businesses. How did we do?   Click to learn the latest on  #HopkinsLocal. https://t.co/Fld5EJUTJ4 https://t.co/vlMazFTJlM",172477,1,JohnsHopkins,2019-02-21 15:02:30,6,['HopkinsLocal']
"FYI - JHU is following its regular class and other operational schedules today, Thurs., Feb. 21.",172477,1,JohnsHopkins,2019-02-21 12:04:10,8,[]
Thanks! It took a lot for us to convince Jay to let us tell the story. ;-) https://t.co/fqJKWwtGit,172477,1,JohnsHopkins,2019-02-20 19:16:59,4,[]
"b'Calling all next-generation #innovators!! @GSK will invest $700,000 this year to seek applications from JHU faculty (including @JHUAPL)  based on novel science, technologies, materials or processes that will lead to improved consumer health outcomes! https://t.co/rlOml3vZyB https://t.co/tlVZbeRTsb'",172477,3,JohnsHopkins,2019-02-20 17:37:53,0,['innovators']
"b""Today's closing of @JohnsHopkins looks much more justified now than it might have just an hour ago. #snowday https://t.co/GDGTc2Wmrf""",172477,70,JohnsHopkins,2019-02-20 14:57:23,0,['snowday']
b'Reporting live from the @JohnsHopkins Tower of Power competition. Carbs and creativity are at an all-time high. #HopkinsEngineer #EWeek2019 https://t.co/Rtz5Sz0tN9',172477,3,JohnsHopkins,2019-02-20 14:16:19,0,[]
b'Auditions are ON at the @george_peabody Conservatory.  Make Chopin your Snow Plan. @JohnsHopkins @JHU_Admissions https://t.co/9AgS3D8mvc',172477,2,JohnsHopkins,2019-02-20 14:15:47,0,[]
"b""The university's closure tomorrow also means that the E-Week events scheduled for February 20 have been canceled. We'll keep you posted at https://t.co/mV0bJsUnyK with information about the rescheduled events.""",172477,1,JohnsHopkins,2019-02-20 03:42:50,0,[]
"Johns Hopkins University will be closed on Wednesday, Feb. 20. All day and evening classes are canceled. (BUT, Peabody Conservatory audition week activities will take place as scheduled.)   If in doubt as to status, please click for full update: https://t.co/Dxx5xG5zKK https://t.co/AVViMjhwpp",172477,14,JohnsHopkins,2019-02-20 01:20:54,27,[]
"b'It IS intriguing! Stop by the Beach today, 3:30 - 5, to build and launch a water #rocket with the AstroJays for #EWeek2019. @HopkinsEngineer https://t.co/KWo9vkLYyD'",172477,4,JohnsHopkins,2019-02-19 15:07:43,0,"['rocket', 'EWeek2019']"
"Our mascot, Jay, has a new look! This video documents the transformation.   Read the exclusive interview on the Hub:  https://t.co/ZVWMw1n5PV  #GoHop! https://t.co/y7FvDF4jLx",172477,26,JohnsHopkins,2019-02-19 04:05:24,110,['GoHop']
"b'""Practicing high-quality care requires a human touch. That will never go away,"" writes @withyouDrWu. ""The great irony today is that artificial intelligence may prove to be the force that helps bring that human touch back to the forefront of medicine."" https://t.co/QhoXf6D1lm'",172477,13,JohnsHopkins,2019-02-19 01:44:04,0,[]
"@TheRealMJMartin Good luck, Matt.",172477,0,JohnsHopkins,2019-02-19 01:43:22,1,[]
Check out Feb 19: AstroJays water-powered rockets and Tower of Power? Intriguing. https://t.co/iuYfRpSpYy,172477,1,JohnsHopkins,2019-02-19 01:38:10,11,[]
"This is a two-year program where students can spend time both in Europe and Washington, D.C. #InternationalStudies https://t.co/LkzMp0Q9HB",172477,1,JohnsHopkins,2019-02-19 01:34:29,4,['InternationalStudies']
"b'As a leader in biotechnology research and innovation, Johns Hopkins University has given our nearly century-old school mascot a complete physical makeover, significantly improving his presence and function. The future is now! Photo credit @JHHomewoodPhoto #jhu #spirit #gohop https://t.co/W87pVSryrf'",172477,2,JohnsHopkins,2019-02-19 01:27:28,0,[]
b'Junior faculty at @JohnsHopkinsSPH @HopkinsMedicine @IJHNursing @JohnsHopkins apply! https://t.co/HFZdL2n2mB',172477,5,JohnsHopkins,2019-02-19 01:23:56,0,[]
"Looking good, Jay! https://t.co/AHVKJ4LPis",172477,10,JohnsHopkins,2019-02-17 06:25:25,40,[]
b'Love the ?@JohnsHopkins? #BlueJay?s new look!!! https://t.co/DXt34LLcfL',172477,2,JohnsHopkins,2019-02-17 06:21:19,0,['BlueJay']
@deniswirtz Wow!,172477,0,JohnsHopkins,2019-02-16 19:56:17,1,[]
"b'On Saturday, Feb. 23, all @JohnsHopkins faculty, staff, students, and their families will be offered free admission to the @LewisMuseum in celebration of #BlackHistoryMonth. https://t.co/vlWLWo0htG'",172477,8,JohnsHopkins,2019-02-16 17:38:45,0,[]
"b""The blue jay mascot @JohnsHopkins will reveal himself at Saturday's lacrosse game to be an ALL NEW bird. Come check his new self out. https://t.co/arsFEziqxS https://t.co/c8QXfyPUgu""",172477,7,JohnsHopkins,2019-02-16 04:18:47,0,[]
"@richardkidd Richard, thank you for reaching out. We will pass on your note to our Transportation Department.",172477,0,JohnsHopkins,2019-02-16 04:13:36,0,[]
"b'Congrats to Beth McGinty of the @JohnsHopkinsSPH @JHSPH_HPM on receiving $50,000 from @JohnsHopkins President Daniels for her work on communication strategies that build support for public health policies while decreasing stigma for the affected groups: https://t.co/DG3wIRvVb2 https://t.co/hQPZoQpspp'",172477,11,JohnsHopkins,2019-02-14 03:06:26,0,[]
"&lt;Drum roll, please&gt;  And this year's winner of the President's Frontier Award, which comes with a $250,000 prize, goes too.....   Read more here --&gt; https://t.co/w14o9zJBGy https://t.co/gdP3xFTOVB",172477,5,JohnsHopkins,2019-02-14 03:05:42,36,[]
"b'Meet Sarah H?rst @PlanetDr?assistant professor @JHUEPS, her primary research interest is atmospheric chemistry. She is particularly interested in the complex organic chemistry occurring in the atmosphere of #Titan. ? #WomenInScience #GoHop https://t.co/7QAUBtgjkj'",172477,26,JohnsHopkins,2019-02-12 12:24:52,0,[]
"b'Meet @PlanetSabine?planetary scientist, @JHU_BDPs professor @JHUEPS and @JHUAPL, her current research projects are in planetary magnetic fields, dynamo theory, and planetary interior structure models. ?#WomenInScience #GoHop https://t.co/N9KBkxeL2w'",172477,8,JohnsHopkins,2019-02-12 12:19:15,0,[]
JHU Operations Update: The university will open today at 10 am due to inclement weather. Read more at https://t.co/gSKzqp8DXK https://t.co/udDyzo4rRT,172477,5,JohnsHopkins,2019-02-12 12:03:44,4,[]
"JHU operations update for this afternoon, Feb. 11: The university will be closing today at 5 pm. To see the full announcement, please click here: https://t.co/NHtkmMhOhH https://t.co/4Ten98lSRT",172477,7,JohnsHopkins,2019-02-11 19:57:02,9,[]
"b'Researchers from @JohnsHopkins, @UofMaryland, and @NASAJPL have found another use for the Mars Curiosity Rover: making the first surface gravity measurements on a planet other than Earth https://t.co/rtEO71qcf2'",172477,3,JohnsHopkins,2019-02-11 14:20:41,0,[]
"@karaokehannah The university is open on its regular schedule today. If any changes, notifications will be made ASAP here, on our Alerts page, and other methods. Thanks for asking for an update.",172477,0,JohnsHopkins,2019-02-11 13:15:52,0,[]
"@sarahthememe Yes, we are open on a regular schedule today. If that changes, we’ll make notifications ASAP. Thank you for messaging us and asking.",172477,0,JohnsHopkins,2019-02-11 13:14:01,1,[]
"@KayteAndersen @JohnsHopkinsSPH We are open on a regular schedule today. If that changes, the university will notify ASAP. Thank you for messaging us for clarification.",172477,0,JohnsHopkins,2019-02-11 13:12:56,1,[]
"Update: The university is open on a regular schedule today, Monday, Feb. 11.",172477,5,JohnsHopkins,2019-02-11 13:03:49,9,[]
Thank you for helping! https://t.co/wSUaitvTGv,172477,2,JohnsHopkins,2019-02-09 20:25:01,6,[]
"b'Reading and Tweeting Science, a #JHU Intersession course with @Dr_EmilyFisher and @MelanieLJohn, preps students to process #scientific articles, find meaning in complicated texts, and succinctly communicate results. #ReadTweetSci19 https://t.co/sKwut1sglb'",172477,5,JohnsHopkins,2019-02-09 17:30:58,0,['JHU']
"Thanks for your work, Cassandra, and all those at Hopkins who work on developing these new educational experiences for wider audiences. #GoHop https://t.co/ZSn1rFaHne",172477,1,JohnsHopkins,2019-02-07 03:43:50,12,['GoHop']
"b'Just wrapped up recording my first lectures for our #MOOC, ?Reducing Gun Violence in America: Evidence for Change? ?  Keep an eye out for course launch in May 2019. @JHCGPR @JohnsHopkinsSPH https://t.co/QXJxwZEOL7'",172477,22,JohnsHopkins,2019-02-06 18:10:20,0,['MOOC']
"b""The 2019 @JohnsHopkins Alumni Survey hit your inbox this morning. Tell the @JHU_Alumni Association what you like, where they can improve, and the direction you'd like to see them go in over the next five years.? #JHUAlumni #HopkinsPromoters #JHAAPromo https://t.co/abto7ySIjm""",172477,2,JohnsHopkins,2019-02-06 15:27:14,0,[]
"b'One week from today, join us and @wacphila for The Global Rise of Authoritarianism featuring a panel discussion with @HRF chairman @Kasparov63, @JohnsHopkins professor and @Slate columnist @Yascha_Mounk, and @StanfordLaw professor Curtis Milhaupt.  More: https://t.co/JrYeBrBbEL https://t.co/1eaPp0IOBt'",172477,12,JohnsHopkins,2019-02-05 19:19:24,0,[]
"b""Happy Lunar New Year! Here's a throwback to the 2014 celebration hosted by the Chinese Student Association at @JohnsHopkins. (Image: Will Kirk / Homewood Photography) #YearOfThePig #ChineseNewYear https://t.co/mTu0KmWZpp""",172477,7,JohnsHopkins,2019-02-05 18:46:17,0,[]
b'Happy Chinese New Year! Stop by the ECE Lounge for decorations and free oranges! https://t.co/BdQGLKVIL5',172477,2,JohnsHopkins,2019-02-05 17:38:53,0,[]
b'Tonight: Learn more about study abroad opportunities at @JohnsHopkins! Join the Office of Study Abroad at 5 p.m. in the Glass Pavilion for the Study Abroad Fair. https://t.co/O2BxIdZKsK',172477,4,JohnsHopkins,2019-02-05 15:02:54,0,[]
"b'Read today\'s blog post by Earle Havens, Curator of #rarebooks &amp; #manuscripts at @JohnsHopkins @mselibrary, which is a re-post from @univofstandrews\'s ""Preserving the World\'s Rarest Books Project,"" https://t.co/FGZMnjAr9p  #TuesdayMotivation https://t.co/Eo5g9jF9MR'",172477,2,JohnsHopkins,2019-02-05 13:33:13,0,"['rarebooks', 'manuscripts']"
"b'After completing her PhD at @JohnsHopkins, she worked for 25 years at AT&amp;T Bell Laboratories in Holmdel, NJ, before joining @JHUAPL. #MathematicallyGiftedAndBlack #BlackHistoryMonth https://t.co/wkQbJKNIxz'",172477,16,JohnsHopkins,2019-02-05 13:09:36,0,[]
"b'Fill out those 2019 @JohnsHopkins Alumni Surveys, Hopkins Family. There are just days left before we close it out, and we want to hear from you! Learn more: https://t.co/k5JOvkvkBi https://t.co/FIRNaawWmo'",172477,4,JohnsHopkins,2019-02-05 13:09:25,0,[]
