"b'""When I gathered my colleagues last year to draft a new strategic plan for @JohnsHopkinsSPH, we found one constant,"" writes @EllenJMacKenzie. ""Baltimore."" https://t.co/BUFV7LNdMg'",172477,14,JohnsHopkins,2019-11-15 17:28:01,0,[]
"b'""Most of the time, research in our field is about getting computers to think like people,? says @chazfirestone. ""Our project does the opposite?we?re asking whether people can think like computers."" ?Can you think like a machine? Try this test ??via @HubJHU https://t.co/uaKtTOFpOw'",172477,4,JohnsHopkins,2019-11-15 16:26:55,0,[]
"b""Emily Maheras named @CentennialConf Women's Soccer Player of the Year, four other Blue Jays named to All-Centennial teams! #GoHop   https://t.co/pg25ynkJJN https://t.co/5ORthXNXQZ""",172477,5,JohnsHopkins,2019-11-15 16:26:01,0,[]
"""It's so common that powerful women just make the footnotes of history-book chapters."" –@devikabhise, @JHUArtsSciences alum, on her new film @WarriorJhansi",172477,1,JohnsHopkins,2019-11-15 16:05:14,6,[]
"The Warrior Queen of Jhansi comes to theaters today. Hopkins alum Devika Bhise stars in this tale of women’s empowerment, which she wrote with her mother. #TheWarriorQueenofJhansi https://t.co/5TPbHUEk3S",172477,0,JohnsHopkins,2019-11-15 16:04:12,10,['TheWarriorQueenofJhansi']
"b'.@JHUVB placed a program-high 4? members on the @AVCAVolleyball All-Region First Team! JR Natalie Aston became the 1st player in program-history to earn Region Player of the Year honors, while Matt Troy grabbed his 2nd career Coach of the Year accolade!  ?https://t.co/9hZmkfDtSy https://t.co/ya0lqwjPGD'",172477,5,JohnsHopkins,2019-11-15 15:15:37,0,[]
b'Johns Hopkins SAIS Prof. @jonasnahm and @gwengineering Prof. @JohnHelveston argue in a @sciencemagazine article that increased collaboration with China for the development of low-carbon energy technologies is critical for combating climate change. https://t.co/YxWrM0EeVl',172477,9,JohnsHopkins,2019-11-15 14:08:29,0,[]
"In the 2018 midterm election, 44.8% of Hopkins students cast their votes, more than tripling our 2014 turnout. https://t.co/YY1yKk4BzP",172477,7,JohnsHopkins,2019-11-15 13:06:36,24,[]
"b'Join us for the Symposium on Humanism and Medicine: As If the Patient Mattered, at the Turner Auditorium at JHH on Saturday, Dec. 14. Learn about topics ranging from burn out to erosion of the relationship between provider &amp; patient. Learn more here: https://t.co/gNMfRsGr4J.'",172477,46,JohnsHopkins,2019-11-14 21:57:31,0,[]
@BondLamberty @NWcounselors @NorthwoodPrin Thanks for visiting us!,172477,0,JohnsHopkins,2019-11-14 17:42:25,1,[]
b'The Veteran Amputee Skin Regeneration Program at @JohnsHopkins is developing a cell therapy that could enable those who wear prosthetics to use their devices longer. https://t.co/EIwUJcSFno',172477,11,JohnsHopkins,2019-11-14 13:41:32,0,[]
A recent survey found that only 40% of U.S. adults could name all three branches of the federal government. More than 20% couldn't name any. #civics https://t.co/4euYyjglpQ,172477,3,JohnsHopkins,2019-11-13 21:20:10,5,['civics']
"b""Happy #WorldKindnessDay!  Here's a throwback to when #JHU2019 graduates showed their gratitude for the people who supported them at @JohnsHopkins. https://t.co/bnQO2Y0eo1""",172477,1,JohnsHopkins,2019-11-13 20:06:48,0,"['WorldKindnessDay', 'JHU2019']"
"b'You can catch History professor @marthasjones_ this Thursday, 9/14 at the @smithsoniannpg  #JHUWomensVote100 #votesforwomen https://t.co/Z6FKjm3NEH'",172477,5,JohnsHopkins,2019-11-13 19:04:32,0,['JHUWomensVote100']
b'Don?t forget to stop and appreciate the fall colors on your walk across @JohnsHopkins Homewood campus to Maryland Hall for our #MatSci Seminar Series! ?2:30-3:30pm in Room 110  #homewoodcampus #foliageappreciation #gohop https://t.co/OfNS0da5jn',172477,3,JohnsHopkins,2019-11-13 18:46:25,0,[]
"b'The Rising Stars workshop brought more than 20 of the nation?s best female junior biomedical researchers to @JohnsHopkins for two days of intensive career development workshops, networking activities, and panel sessions. Read more: https://t.co/MoMiKHiJZW https://t.co/7hNERIY2Vl'",172477,7,JohnsHopkins,2019-11-13 16:57:05,0,[]
"""You take a blank canvas, you have certain fundamental rules, but it's all open..."" JHU math professor Joel Spruck explains the labor of love that is mathematical problem solving. https://t.co/G6fVBREFG6",172477,2,JohnsHopkins,2019-11-12 20:59:46,17,[]
"b'Do you have the next big business idea? Complete the Student Startup Challenge application by Sunday, Nov. 17th for your chance to have the winning pitch! Register now: https://t.co/XVaBicoc8P https://t.co/WRpqkVJ25K'",172477,3,JohnsHopkins,2019-11-12 19:15:26,0,[]
"b'""At the right frequency the mosquitoes have a hard time flying and can\'t complete their mating ritual,"" says #HopkinsEngineer Rajat Mittal. https://t.co/U0Qpq9JoGn'",172477,3,JohnsHopkins,2019-11-12 19:13:07,0,[]
"b'Tonight at 6pm! Join journalists and scholars to explore the state of digital campaigning, advertising, and analytics in electoral politics.    @aprilaser @sissenberg @nancyscola @ScottShaneNYT @jesse_b_p @kreissdaniel  Register: https://t.co/JQsLbT2pue https://t.co/j0RvjavT3q'",172477,8,JohnsHopkins,2019-11-12 19:08:24,0,[]
A fictional pandemic scenario designed by @JohnsHopkinsSPH experts reveals a troubling takeaway: the U.S. is nowhere near prepared for potential biological disasters. https://t.co/hkPtPqRf8o,172477,5,JohnsHopkins,2019-11-12 16:42:19,12,[]
"b'Summer mornings on the @JohnsHopkins are awesome, but fall mornings might top them. https://t.co/8wPwJkR1hW'",172477,1,JohnsHopkins,2019-11-12 16:25:54,0,[]
"@prbrian @calm We're so glad to hear it! Whether for productivity or stress relief (or both!), we're happy to be able to offer this to employees and students.",172477,0,JohnsHopkins,2019-11-12 16:16:19,2,[]
Even a picture of a clock is right twice a day. https://t.co/2tcEadgOKm,172477,1,JohnsHopkins,2019-11-12 04:11:00,41,[]
"To improve patient safety, medical practitioners should focus less on what goes wrong and more on reproducing what goes right, says Bloomberg Distinguished Professor @KMSutcliffePhD: https://t.co/D6PLkpYE4h",172477,7,JohnsHopkins,2019-11-12 00:26:00,15,[]
b'An Alum (and Veteran!) Flew Flags in Combat in Honor of @JohnsHopkins Hopkins #ThankYouForYourService #VeteransDay https://t.co/YEO5mqyeSx https://t.co/PFZUHqvpcK',172477,9,JohnsHopkins,2019-11-11 23:31:07,0,"['ThankYouForYourService', 'VeteransDay']"
"""We do everything we can to serve those who serve"" —Luis Garza, @HopkinsMedicine Garza's team at the Veteran Amputee Skin Regeneration Program is developing a cell therapy to help service members who wear prosthetics. #VeteransDay https://t.co/MoDHizLVGo",172477,1,JohnsHopkins,2019-11-11 18:17:41,13,['VeteransDay']
"b""It's #MercuryTransit day! ???   Our innermost planet will cross right in front of the Sun's disk. #DYK that APL's MESSENGER was the first spacecraft to orbit Mercury? Find out how that mission that revolutionized our view of terrestrial planet formation: https://t.co/fvatG3C0oc https://t.co/Mi4aD31jTh""",172477,14,JohnsHopkins,2019-11-11 14:43:04,0,"['MercuryTransit', 'DYK']"
"b""Nicholas Theodore, director of the Johns Hopkins Neurological Spine Center and a former senior general medical officer with the Marine Corps spoke at the hospital's #VeteransDay Commemoration two years ago and offered insight about Hopkins veterans. https://t.co/YVprVXjPVe""",172477,2,JohnsHopkins,2019-11-11 14:40:32,0,[]
b'Happy #MatSciMonday! Maryland Hall is the oldest building on the @JohnsHopkins #Homewood campus. The building may be historic but the work being done inside is all about the future!  Check out our website to learn more. https://t.co/kcWZ91LMJX https://t.co/FJMyB6WLDs',172477,3,JohnsHopkins,2019-11-11 14:10:56,0,"['MatSciMonday', 'Homewood']"
"""The East German regime did not actually intend to open the wall."" @SAISHopkins historical studies professor explains how a series of blunders led to the opening of the #BerlinWall, 30 years ago today. https://t.co/mCOOKH5S6W",172477,1,JohnsHopkins,2019-11-09 14:25:16,7,['BerlinWall']
"b'If you were a student of mine, Steve was your grand-teacher.  A force of nature, a kind soul, a brilliant writer.  Thank you Steve for everything you taught me. ?@JohnsHopkins?  https://t.co/HjjsjiIh1i'",172477,2,JohnsHopkins,2019-11-08 20:43:22,0,[]
"b'We bid a fond farewell to Stephen Dixon, professor at @JohnsHopkins Writing Seminars, and the author of four collections of short stories with JHU Press. https://t.co/dMzvXoaiX7'",172477,4,JohnsHopkins,2019-11-08 20:08:20,0,[]
"Dannis Cazarez was the first in her family to apply to college. Now a sophomore, she is a mentor for other first-generation students, both here at Hopkins and back home in North Carolina. #CelebrateFirstGen https://t.co/vaCTvGR4bP",172477,2,JohnsHopkins,2019-11-08 18:02:16,16,['CelebrateFirstGen']
"b'Scientists at @JohnsHopkins, @UCLA find that copper particles stabilize the platinum-nickel catalysts that hydrogen fuel cells use to produce clean electricity. https://t.co/3UDsGbs97J'",172477,7,JohnsHopkins,2019-11-08 16:48:28,0,[]
"The path to college isn’t the same for everyone. Through our FLI Network, we aim to ensure all Hopkins students feel excited to contribute to our community and empowered to meet their full potential. #CelebrateFirstGen https://t.co/mqKqYfJsAJ",172477,11,JohnsHopkins,2019-11-08 16:19:49,38,['CelebrateFirstGen']
b'Happening now at @JohnsHopkinsSPH!   @HopkinsMedicine &amp; @JohnsHopkins graduate and postdoctoral students are attending a packed day of professional development workshops. #JHUPDday2019 https://t.co/VPVaqsgq4U',172477,2,JohnsHopkins,2019-11-08 15:28:25,0,[]
"b'Nov. 12: Journalists @aprilaser @sissenberg @nancyscola  @ScottShaneNYT will explore the state of digital campaigning, advertising, and analytics in electoral politics. Join us for the event!   Co-Sponsors: @unc_citap #SNFAgora  Register: https://t.co/JQsLbTk0SO https://t.co/nXRQKAIy1O'",172477,14,JohnsHopkins,2019-11-08 14:23:21,0,[]
"Just three years after completing her teaching degree at @JHUEducation, Kelly Harper became Washington D.C.'s 2019 Teacher of the Year and one of just four finalists for National Teacher of the Year. https://t.co/fFEn7OUTF9",172477,1,JohnsHopkins,2019-11-07 18:46:36,24,[]
b'A glimpse of the beautiful @JohnsHopkins Homewood campus from yesterday morning. https://t.co/SmskmH0FV2',172477,2,JohnsHopkins,2019-11-07 13:48:06,0,[]
b'Doubling up on autumn ? https://t.co/tnvCqaR8QU',172477,2,JohnsHopkins,2019-11-06 20:18:38,0,[]
"b'A new paper from @JHUPhysicsAstro professor Joseph Silk, @OfficialUoM cosmologist Eleonora Di Valentino, and @SapienzaRoma cosmologist Alessandro Melchiorri supports the idea of a #ClosedUniverse. ? https://t.co/4HhANPwj3G'",172477,3,JohnsHopkins,2019-11-06 20:18:04,0,[]
"b""#JHUAPL's Luke Osborn talks about the methods he and his team are using to give amputees the ability to feel sensations, such as pressure, with modern prosthetics and biomedical engineering. Check him out on the @FuturetechP podcast! ? https://t.co/EhFTFLs9fG https://t.co/qRnn49sMEM""",172477,5,JohnsHopkins,2019-11-06 20:11:44,0,['JHUAPL']
"b'1 WEEK FROM TODAY! Featuring a health care tech expo, interactive demos and a keynote on telemedicine. More info and registration here: https://t.co/8Jlue2bywB @JHMTIC #innovation #baltimore https://t.co/T4ajE3HPVs'",172477,3,JohnsHopkins,2019-11-06 20:08:21,0,[]
"b""A tool developed by @JohnsHopkinsEPI's @AndrewAzman and his team at @JohnsHopkinsSPH could help countries identify potential cholera outbreaks faster than ever. #PowerofPublicHealth  https://t.co/AbFgyVP6Mt""",172477,13,JohnsHopkins,2019-11-06 20:07:48,0,[]
New research from @JohnsHopkinsSPH has uncovered evidence that elevated exposure to acetaminophen in the womb is linked with higher rates of autism and ADHD diagnoses in childhood. https://t.co/OfnUI92wXf,172477,28,JohnsHopkins,2019-11-06 19:33:50,50,[]
"NOW LIVE: ""Civics &amp; The Future of Democracy"" conference from @SNFAgoraJHU and @AtlanticLIVE. Tune in: https://t.co/uwhyk26t2Z https://t.co/q76Idw7xfG",172477,1,JohnsHopkins,2019-11-06 13:56:45,2,[]
"Starting in fall 2020, students from Vietnam will be able to pursue graduate degree programs at JHU on full scholarship, thanks to a partnership between @HopkinsEngineer and the Vingroup Scholarship Program. https://t.co/6NxymafLd0",172477,2,JohnsHopkins,2019-11-05 21:00:10,13,[]
Test your #civics knowledge with this quiz from @SNFAgoraJHU! Then tune in to their upcoming conference this Wednesday on Facebook Live (https://t.co/gS6BuFrnuY). https://t.co/ZqGIjhcaKd,172477,0,JohnsHopkins,2019-11-04 23:52:00,4,['civics']
"@JHUSOURCE @livingclassroom The Idea Lab is currently accepting new proposals that further JHU's goals for sustainability, diversity, and excellence. Current students, faculty, and staff can enter here: https://t.co/lyVgRQNBlz https://t.co/kxyH9gSozX",172477,4,JohnsHopkins,2019-11-04 23:50:13,4,[]
"The Identity Clinic helps homeless, recovering, and previously incarcerated Baltimore City residents obtain basic identification. This partnership between @JHUSOURCE &amp; @livingclassroom is thanks to a $20,000 Idea Lab grant in 2016. https://t.co/9OvL6b04p0",172477,7,JohnsHopkins,2019-11-04 21:05:02,27,[]
b'?? Cu in the future   New research from @JohnsHopkins and @UCLA suggests that copper could help unlock the clean energy-potential of hydrogen fuel cells. https://t.co/33ggvuKw9d',172477,6,JohnsHopkins,2019-11-04 20:29:49,0,[]
"b""Exciting news! Starting in June 2020, the MPH program at  @JohnsHopkinsSPH will be available in a fully online format, which makes the School's world-renowned training even more accessible to students globally. Apply now! #APHA2019 https://t.co/HRK5aD4aAv""",172477,13,JohnsHopkins,2019-11-04 16:37:57,0,[]
b'The newest Arts and Sciences BDPs was featured in the  @JHUArtsSciences Magazine. We have the best of the best! https://t.co/YIUppitzOr?  @mattkahn1966 @JHU_Cities @deniswirtz @ibphillips',172477,5,JohnsHopkins,2019-11-04 16:37:24,0,[]
The material will be tested aboard the @Space_Station for its ability to protect against space radiation. The test results could inspire new ideas about how to protect humans from harmful radiation on Earth and in space.,172477,0,JohnsHopkins,2019-11-02 21:52:03,6,[]
Aboard the spacecraft launched this morning from @NASA_Wallops are the first melanin samples to be sent to space for testing. @JohnsHopkinsSPH researcher Radamés J.B. Cordero has spent the past four years developing and studying the samples. https://t.co/E4dwACbMyu,172477,5,JohnsHopkins,2019-11-02 21:37:53,24,[]
"Johns Hopkins University is proud to support #BrilliantBaltimore and celebrates all of the people, places, and programs that make our city shine. Visit https://t.co/CFQhsOZ3vB for details. https://t.co/3TOtKDbzWX",172477,5,JohnsHopkins,2019-11-01 20:58:55,18,['BrilliantBaltimore']
Congratulations to the JHU undergraduate Team Relavo on their recognition at the Collegiate Inventors Competition! They designed a device that reduces infection rates in at-home dialysis treatments for patients with kidney failure. https://t.co/wuc1VEH3H0,172477,1,JohnsHopkins,2019-11-01 14:05:35,24,[]
@JHU_Alumni That's debatable. There are basically two schools of thought.,172477,0,JohnsHopkins,2019-10-31 20:14:12,2,[]
@JHUNursing Incredible creativity!,172477,0,JohnsHopkins,2019-10-31 19:24:14,2,[]
b'How do we look? Here are a few of our pumpkin contest contestants #Halloween https://t.co/fYUJxwPoWQ',172477,5,JohnsHopkins,2019-10-31 19:23:36,0,['Halloween']
"@theofficenbc @rainnwilson Dunder Mifflin, this is Jay. #Halloween2019 https://t.co/QT82NdhBC1",172477,0,JohnsHopkins,2019-10-31 19:21:07,11,['Halloween2019']
b'It is #Halloween. https://t.co/LUrOSNLZHY',172477,3,JohnsHopkins,2019-10-31 19:08:29,0,['Halloween']
b'@JohnsHopkins dressed Jay for a day at #TheOffice ? ? #HappyHalloween #TikTok https://t.co/Hhlq2GOOWl',172477,1,JohnsHopkins,2019-10-31 19:07:52,0,"['TheOffice', 'HappyHalloween', 'TikTok']"
@yashaswini_7 https://t.co/8w52BgDnMh,172477,0,JohnsHopkins,2019-10-31 18:48:48,2,[]
FACT: We went all out on Jay's #Halloween costume this year. #TheOffice https://t.co/jVDc6XH7aP,172477,14,JohnsHopkins,2019-10-31 18:06:14,100,"['Halloween', 'TheOffice']"
"@mattkahn1966 Dwight ""J."" Schrute's hair cannot be tamed. Happy Halloween, Matthew!",172477,0,JohnsHopkins,2019-10-31 17:57:52,1,[]
@theofficenbc Our mascot Jay has been planning his costume all month. We’ll reveal the full costume tomorrow! https://t.co/BybnvA3hgH,172477,0,JohnsHopkins,2019-10-30 22:00:04,6,[]
"What do Lady Gaga, Ronan Farrow, Adam Riess, and Andrew Yang have in common? They all attended @CTYJohnsHopkins, which just celebrated its 40th anniversary. https://t.co/kqm9Ojbf7G",172477,12,JohnsHopkins,2019-10-30 18:57:47,36,[]
"Babies as young as 14 months old understand that counting is related to quantity, even if they don’t necessarily know what words like “two” or “five” mean. https://t.co/RWlg9pFvm9",172477,4,JohnsHopkins,2019-10-29 21:12:25,10,[]
"How do children learn to count? It turns out they understand the fundamentals years before they can actually say numbers, according to new research from the Johns Hopkins University Laboratory for Child Development. #languageacquisition https://t.co/bvbrQuW9Ho",172477,3,JohnsHopkins,2019-10-29 21:11:31,20,['languageacquisition']
"b'Johns Hopkins Hospital and @hopkinsbayview collected almost 90lbs of medications at the National Drug Take-Back day this past Saturday.  Looking forward to the next event in April, 2020. #JHTakeBack https://t.co/ewAfb0ShpB'",172477,2,JohnsHopkins,2019-10-29 13:53:45,0,[]
"b'""For any diet-related climate change solution to be sustainable, it must also address the problems of under nutrition, obesity, poverty, and economic development."" @mwbloem https://t.co/83tTyopiTn https://t.co/nvU6I49bRF'",172477,7,JohnsHopkins,2019-10-29 13:52:45,0,[]
"b'Over 4 decades, #CTY nurtured the talents of the founders of Facebook and Google, Rhodes Scholars, Nobel Prize?winners, and MacArthur Fellows, Grammy winner Lady Gaga, Pulitzer Prize?winner Ronan Farrow, and Fields Medalist Terence Tao. Not too shabby? ? https://t.co/owdhGEDfn8'",172477,16,JohnsHopkins,2019-10-29 13:26:34,0,['CTY']
b'A doggone good time during Family Weekend at @JohnsHopkins! https://t.co/KLDlG925Mg',172477,3,JohnsHopkins,2019-10-29 12:55:16,0,[]
"b""Diversity is important. Whether race, gender, or other factors, patients respond to caregivers who are like them.   And we're on the precipice of a shortage. We need more nurses.  @JohnsHopkins President Daniels introduces @ANApresident Ernest Grant #GoHop #NursingNow2020 https://t.co/d0WWaWd25a""",172477,12,JohnsHopkins,2019-10-29 12:55:03,0,[]
"b'Baltimore, late October.  @johnshopkins https://t.co/dmf601dLtb'",172477,7,JohnsHopkins,2019-10-28 19:39:52,0,[]
"b'As we celebrate our 75th anniversary, SAIS Magazine sat down with Dean @EliotACohen and SGA President @shamailaashraf for a discussion on our changing world, the school?s future, and curricular changes that will be nothing short of transformational. https://t.co/hzoLbeQXyp'",172477,5,JohnsHopkins,2019-10-25 18:44:00,0,[]
"b""We're thrilled to celebrate @Jhpiego's Dir. of Nursing &amp; Midwifery, Peter Johnson, and his fellow @JHUNursing colleagues as they're inducted into the @AAN_Nursing. Congratulations to all - what an achievement! https://t.co/8K0fg18JLs""",172477,6,JohnsHopkins,2019-10-25 18:01:27,0,[]
b'Celebrating 75 years of cultivating lasting professional and social networks among students. https://t.co/r1xVIyghec #JOHNSHOPKINSSAISAT75 https://t.co/98Er3iChxh',172477,5,JohnsHopkins,2019-10-25 17:56:23,0,[]
"b""Congrats to our own @SenBillFerg, SOE's director of reform initiatives, and MAT ?07 and @TeachForAmerica #Baltimore alum, on his selection as MD's next #SenatePresident. We look forward to all he will do for the citizens of Maryland. https://t.co/NGEDeH9ABR""",172477,5,JohnsHopkins,2019-10-25 17:22:26,0,['Baltimore']
"@CK_826 From 9am-5pm, the Remington and Keswick shuttles can take you to Homewood. Schedules and routes are here: https://t.co/Uy6fBrUE6L After 5:30pm, you can request a Night Ride (called ""Homewood Service"" in the TransLoc app).",172477,0,JohnsHopkins,2019-10-25 13:56:21,2,[]
"b'#OTD in 1946 (incidentally also a Thursday), at the White Sands Missile Range, #JHUAPL researchers used a #WWII rocket to take the first photos of the Earth from space. ?? #TBT https://t.co/ZO8qfzqkuL https://t.co/6QKF5d1pla'",172477,16,JohnsHopkins,2019-10-24 16:53:42,0,"['OTD', 'JHUAPL', 'WWII']"
"The economic consequences of climate change may be worse than the housing crisis and Great Recession combined, according to research by JHU's @mattkahn1966 and co-author @amine_ouazad. https://t.co/OXYLVytENr",172477,8,JohnsHopkins,2019-10-24 15:59:16,7,[]
"Not only is @JHUAPL's lithium-ion battery cuttable, submersible, and flexible, but it also addresses a key unmet need: this combustion-proof battery improves our safety, from phone and car use to energy grids. https://t.co/6Vk3wg5OY5",172477,4,JohnsHopkins,2019-10-23 17:20:01,17,[]
"For 20 years, @JHUEducation researcher @bobbalfanz has worked to help students graduate high school. Now he's turned his attention to helping them succeed in college. https://t.co/3XZ0xKZp1g",172477,5,JohnsHopkins,2019-10-23 14:58:47,15,[]
"b'Wondering how the #GND fits into historical perspective? Next week, on Oct. 28: @adam_tooze will give the Green New Deal Dialogue Fall 2019 Keynote address at @JohnsHopkins. Join us! https://t.co/NR5rX4XloT'",172477,3,JohnsHopkins,2019-10-23 14:57:47,0,['GND']
b'Are you a @JohnsHopkins student who wants to spend your summer working at @JHUAPL?   Join us on November 11 to learn more about an incredible research experience. https://t.co/zAC1pKpLHz',172477,6,JohnsHopkins,2019-10-23 14:24:12,0,[]
"Johns Hopkins University has been ranked #11 among 1,500 universities worldwide and #9 among U.S. schools, according to U.S. News &amp; World Report's Best Global University rankings. https://t.co/NnSMATnYpt",172477,33,JohnsHopkins,2019-10-23 00:11:04,86,[]
b'Prof. Monica de Bolle (@bollemdb) weighs in on protests in Chile. https://t.co/NEqWd6QD9b',172477,4,JohnsHopkins,2019-10-22 19:40:00,0,[]
b'Join us for an evening with @ANANursingWorld president @ANAPresident Monday October 28. RSVP https://t.co/5Mt86I09CK https://t.co/58xgkNJPvn',172477,2,JohnsHopkins,2019-10-22 19:39:18,0,[]
@KSadtler @JHElisseeff You’re right! We featured her on the Hub when she was elected last year and we’re so proud she’s now officially been inducted. https://t.co/q2Og2eA3eW,172477,0,JohnsHopkins,2019-10-22 19:28:20,2,[]
"An interdisciplinary approach is needed to optimize wind energy, according to new research by Charles Meneveau of @HopkinsEngineer and other #WindEnergy experts. #sustainability https://t.co/LwyjvotIl5",172477,1,JohnsHopkins,2019-10-22 19:21:22,3,"['WindEnergy', 'sustainability']"
We're thrilled to welcome @KathrynMcDonald as our newest Bloomberg Distinguished Professor. She brings her expertise in health care systems and patient safety to dual primary appointments at @HopkinsNursing and @HopkinsMedicine. https://t.co/4NTYXnUJ4l,172477,4,JohnsHopkins,2019-10-22 15:44:01,34,[]
b'Oct. 28: @adam_tooze will give the Green New Deal Dialogue Fall 2019 Keynote address at @JohnsHopkins. Tooze?s talk will place the idea of a Global Green New Deal in historical perspective. Join us!  For more info: https://t.co/qMOpGFsBKv',172477,4,JohnsHopkins,2019-10-22 14:50:30,0,[]
"b'Welcome to @JohnsHopkins @KathyMcDonald! An expert on health systems, quality and safety, Kathy moves to @JHUNursing, @JHM_Armstrong &amp; @Hopkins_GIM in November. We are thrilled to welcome her to the Hopkins family as a Bloomberg Distinguished Professor. https://t.co/CSZTKgJjtC https://t.co/CQBZ1i1aGd'",172477,16,JohnsHopkins,2019-10-22 14:45:57,0,[]
"A proud moment for Hopkins! Of the 90 new members selected to join @theNAMedicine, four are faculty at @JohnsHopkinsSPH or @HopkinsMedicine. https://t.co/v9lvX8FRj8",172477,19,JohnsHopkins,2019-10-22 14:10:24,50,[]
"b""Student Groups across @JohnsHopkins have until TOMORROW, 10/22 to apply for up to $1500 in grant money from the #JHUAlumni Assn to support their group projects. There's $62K to give away! More here: https://t.co/zbGiL2Bpvs https://t.co/wLcpFNBLKA""",172477,1,JohnsHopkins,2019-10-21 16:00:18,0,['JHUAlumni']
"What can Shakespeare teach us about modern day political theater? A lot, says @SAISHopkins Dean Eliot Cohen. https://t.co/xeByH72a3u",172477,4,JohnsHopkins,2019-10-21 15:14:42,3,[]
"b""Congratulations to @theNAMedicine's Class of 2019, which includes four @JohnsHopkins faculty members!  @JHSPH_HPM chair @ColleenLBarry  @INBT_JHU director Sharon Gerecht @HopkinsMedicine professor Elizabeth Jaffee @HopkinsMedicine professor @Dorry_Segev  https://t.co/8J4QYmSvpO""",172477,8,JohnsHopkins,2019-10-21 14:58:49,0,[]
"b'@JohnsHopkins sociologist Stefanie DeLuca is involved in an ambitious experiment aimed to place housing voucher recipients in areas of high opportunity. More than a year into the pilot program, the early findings are striking. https://t.co/6PBlBajS7E'",172477,3,JohnsHopkins,2019-10-21 13:12:40,0,[]
"Recent and soon-to-be JHU graduates, check out these full-time positions here at Hopkins. Learn more and apply by November 8: https://t.co/duMjUcGaYD https://t.co/1SuDUzRaYe",172477,2,JohnsHopkins,2019-10-20 23:12:49,4,[]
"b'?Elijah Cummings was a fierce and tireless advocate for the people of the city of Baltimore, the state of Maryland and our nation.? -Paul B. Rothman, dean of the medical faculty, VP for Medicine at @JohnsHopkins and CEO of @HopkinsMedicine. https://t.co/x5EOomPtAN https://t.co/hek8f5e7mc'",172477,15,JohnsHopkins,2019-10-18 18:27:50,0,[]
