IHME epidemiologist @davidmpigott is mining the Global Burden of Disease to estimate the impact of other illnesses on clinical outcomes for those infected by the #COVID19 coronavirus.  https://t.co/tZZSt8Sy9x,48466,2,IHME_UW,2020-02-12 03:00:00,6,['COVID19']
"b""Gathering information and metadata is critical to gaining a better understanding of the #coronavirus. Read how one @UW professor is tracking all of the virus' confirmed cases in real time.  https://t.co/tfoZDRUQhU https://t.co/MRsNaj2yfb""",48466,11,IHME_UW,2020-02-12 00:47:59,0,['coronavirus']
"b'There were 51,000 new cases of HIV in the United States in 2017. Will the recently launched ?Ready, Set, PrEP? program be a meaningful step toward HIV/AIDS elimination in the U.S.? #SOTU  https://t.co/uL8YLxYfLC'",48466,2,IHME_UW,2020-02-12 00:31:52,0,[]
"No matter how it’s done, integrating TB and diabetes care will be costly. IHME Research Scientist Kirsten Wiens explains via @ThinkGlobalHlth:  https://t.co/Yz4QKLhdvA",48466,2,IHME_UW,2020-02-12 00:07:23,2,[]
"b'Diabetes and TB?A Complicating Combo https://t.co/GJxEK7X25m. Fascinating and important article by my @IHME_UW colleague Dr. Kirsten Wiens, with awesome chart courtesy @thatscottglenn. @ThinkGlobalHlth'",48466,5,IHME_UW,2020-02-11 23:50:42,0,[]
"Registration for the GBD Technical Workshop is now open!  This workshop aims to help introductory-level learners of the GBD develop mastery and greater fluency in GBD methods, tools, and data. Register online: https://t.co/zz3WKdP0ym https://t.co/9xALRmdFy3",48466,2,IHME_UW,2020-02-11 23:00:03,3,[]
"@davidmpigott @WHO Clinicians, researchers and epidemiologists are working together on new ways to understand the #COVID19 disease caused by the novel coronavirus #nCoV2019.   As IHME professor @DavidMPigott explains, the haste and transparency in the global health community are unprecedented. https://t.co/szoT6q58EI",48466,1,IHME_UW,2020-02-11 18:45:18,2,"['COVID19', 'nCoV2019']"
b'We now have a name for the disease caused by the novel coronavirus: COVID-19.  Having a name matters to prevent the use of other names that can be inaccurate or stigmatizing. #COVID19  https://t.co/HTNjm27BHw',48466,809,IHME_UW,2020-02-11 18:35:47,0,[]
b'Coronavirus and the Cruel Cost of Closing Borders | Think Global Health https://t.co/DQvazKZ57E',48466,2,IHME_UW,2020-02-11 18:25:20,0,[]
"According to our estimates, more than 90% of people globally live in places above @WHO’s target level for air pollution. https://t.co/FfH0o9YllM https://t.co/ih2WLVBBqV",48466,2,IHME_UW,2020-02-11 12:30:17,2,[]
"IHME scientist @davidmpigott is contributing to the @github repository of #coronavirus #nCoV2019 info. Global health researchers are now reaping the benefits of data-sharing networks that have evolved over the last few epidemics, especially Ebola and Zika. https://t.co/jg6ouAyK06",48466,6,IHME_UW,2020-02-10 23:33:46,13,"['coronavirus', 'nCoV2019']"
We could not agree more with @gatesfoundation: @gavi and the @GlobalFund are “grand slams” for improving global health. https://t.co/r4Dxh4MWW3,48466,4,IHME_UW,2020-02-10 18:05:26,11,[]
"b'Have been requested to add some co-morbidity estimates for conditions that could influence #nCoV19 clinical outcomes. Am compiling #GBD estimates from @IHME_UW https://t.co/vGfLMrNEKI. Let me know format tweaks, or other conditions and countries to add. Work in Progress!'",48466,5,IHME_UW,2020-02-10 17:53:30,0,['nCoV19']
"b""Today's topic with 4th year MPharm students was the Global Burden of Disease  and Injuries: we are getting  better at measuring GBD but there are still limitations eg where data is not gathered or extrapolated. Great resources @IHME_UW, thanks to all for excellent discussions. https://t.co/WnmcCc0UYC""",48466,1,IHME_UW,2020-02-10 17:23:56,0,[]
"b'Unable to find this graph elsewhere, I made this graphic today from @IHME_UW Global Burden of Disease data (https://t.co/0qMHFX4lZ2). Please use it if helpful  #NCDs overtook  Group 1 conditions as the leading global cause of DALYs back in 1993 https://t.co/01jBO49Bgv'",48466,21,IHME_UW,2020-02-10 01:21:49,0,[]
"In 2017, the number of new HIV cases was estimated at 51,000 for men and women, according to the IHME-coordinated Global Burden of Disease study. https://t.co/oE9nxAJrsB https://t.co/T5szRD7py0",48466,2,IHME_UW,2020-02-09 23:30:05,2,[]
"b'Coronavirus?Unknown Source, Unrecognized Spread, and Pandemic Potential | Think Global Health https://t.co/nXGcfxQXps'",48466,24,IHME_UW,2020-02-09 17:26:08,0,[]
"According to the IHME-coordinated Global Burden of Disease, 4.6 million deaths in 2017 worldwide were due to air pollution. https://t.co/FfH0o9YllM https://t.co/9mo2jTttTe",48466,2,IHME_UW,2020-02-08 23:30:12,7,[]
"b'Of All the Countries in the World, We?re #USA  the Unhealthiest | Psychology Today @IHME_UW https://t.co/40sxYNpFW6'",48466,1,IHME_UW,2020-02-08 16:36:36,0,['USA']
"“While we may be starting to meet our obligations on outbreak reporting, global reactions without scientific basis are proving much harder to contain,” says IHME's Dr. Deepa Jahagirdar via @ThinkGlobalHlth. #CoronavirusOutbreak https://t.co/cvdOFbntyD https://t.co/PQbrfWZyVE",48466,3,IHME_UW,2020-02-08 15:30:27,2,['CoronavirusOutbreak']
"b'We?re near the bottom in world mental health. How is that possible, since we devote so much attention and resources to these issues?  https://t.co/QtqCouolxQ'",48466,3,IHME_UW,2020-02-08 00:41:19,0,[]
b'Honored to partner with @CSISHealth at @IHME_UW. We?re excited to hear how to strengthen America?s health security! #CSISHealthSecurityCommission #Endingthecycle #healthsecurity https://t.co/Eisv1OG4xa',48466,1,IHME_UW,2020-02-08 00:04:48,0,[]
@davidmpigott What happens when @WHO declares a public health emergency of international concern? @DavidMPigott explains the designation in detail and what it means for the #nCov2019 response. https://t.co/0iwZxaNBbh,48466,3,IHME_UW,2020-02-07 17:38:11,2,['nCov2019']
b'My new @ThinkGlobalHlth post is up examining the potential impact of the #ReadySetPrEP program announced by @HHSGov! Does this push the US closer to #PrEPforall? Read to find out!    https://t.co/iAIf7bOU4X',48466,4,IHME_UW,2020-02-07 17:36:45,0,['ReadySetPrEP']
"b""'La contaminaci?n puede provocar una reducci?n en la capacidad cognitiva, en las habilidades intelectuales y en la memoria', hoy en @quediario https://t.co/PE8p02mnRH cc/ @IHME_UW @yale @seneurologia""",48466,3,IHME_UW,2020-02-07 16:24:13,0,[]
"b'Apply to do your PhD in #globalhealth #inequalities with @CHAIN_NTNU?????? Hiring 2 students to focus on collaboration with Global Burden of Disease Study at @IHME_UW and @UNICEFInnocenti child health research in #LMICs. Read, share &amp; apply by 15 March! ? https://t.co/67Fjh4B6Bo https://t.co/mQMHSQHyAT'",48466,18,IHME_UW,2020-02-07 16:24:05,0,"['globalhealth', 'inequalities']"
b'Are you an advocate or policymaker in a country where disease burden is high? Precision mapping data from @IHME_UW can help you prioritize: https://t.co/zsWoHVoyZQ   #DefeatDD',48466,8,IHME_UW,2020-02-07 16:23:49,0,[]
b'30 years of the #GBD study with expert Prof. Alan Lopez!? Read all about the overarching messages for population #healthpolicies from the GBD and more on what we have learnt from this important data in the past 30 years? https://t.co/x5H7XZ3e4I #ThoughtLeadership https://t.co/xQogh3vsXQ',48466,8,IHME_UW,2020-02-07 04:29:35,0,['GBD']
"Pandemic preparedness expert @DavidMPigott highlights the importance of real-time, accurate data and how researchers worldwide are using https://t.co/nqJvrv4Ty2 to track the spread of #nCoV2019. https://t.co/XusNxNbNMB",48466,13,IHME_UW,2020-02-06 23:00:42,29,['nCoV2019']
Type 2 diabetes cases are rapidly increasing due to a myriad of factors including air pollution and obesity. Policy Translation Manager @kleachkemon and Professor Theo Vos explore key risk factors and prevention efforts in a new piece for @ThinkGlobalHlth. https://t.co/uZaXiHBNhi,48466,3,IHME_UW,2020-02-06 18:45:00,6,[]
"b'For updates on confirmed cases of #nCoV2019, visit: https://t.co/1VShFPzM1M  Special thanks to: @UniofOxford @Tsinghua_Uni @IHME_UW @BostonChildrens @Northeastern @harvardmed https://t.co/quCk2aFgbV'",48466,19,IHME_UW,2020-02-06 17:17:52,0,['nCoV2019']
Children under 5 years old are disproportionately affected by #sepsis and experienced more than 40% of all sepsis cases in 2017. Learn more about the burden of sepsis in @TheLancet: https://t.co/mscmBgJVxV https://t.co/0i5M0wLdIu,48466,8,IHME_UW,2020-02-05 18:30:01,14,['sepsis']
"b""It is not just diet that's driving global increases in #diabetes. Read @kleachkemon &amp; Theo Vox  @IHME_UW on under-recognized role of air pollution in spurring type 2 diabetes, now the 10th leading cause of deaths worldwide. #NCDs https://t.co/sQZQWdNUrR https://t.co/vk3RzHPIPz""",48466,7,IHME_UW,2020-02-05 17:04:00,0,['diabetes']
"b'Last week helped Dra @Pattyjannet1 with start of #GlobalBurdenofDisease think tank @WHO @pahowho #Lima, #Peru with +20 Peruvian expert participants and guests from @IHME_UW Dr. Rafael Lozano &amp; Erin Hamilton #epidemiology #datascience #globalhealth #dataforchange https://t.co/NT2zAPzh8w'",48466,2,IHME_UW,2020-02-05 17:03:55,0,"['GlobalBurdenofDisease', 'Lima', 'Peru']"
"Registration for the GBD Technical Workshop is now open!  This workshop aims to help introductory-level learners of the GBD develop mastery and greater fluency in GBD methods, tools, and data. Register online: https://t.co/CBIdj2mJFG https://t.co/4Uz6TprnOh",48466,1,IHME_UW,2020-02-04 23:30:02,4,[]
b'#D?aMundialContraElC?ncer  La tasa de mortalidad en M?xico x c?ncer d las m?s bajas del mundo  https://t.co/8no1hJE86K y d la regi?n  https://t.co/1kNJqXeAWA  ?Es real o producto d mal registro?  Sin un registro nacional de c?ncer es dif?cil saber la sobrevida d canceres curables https://t.co/k7iistHQc2',48466,9,IHME_UW,2020-02-04 22:01:20,0,['DíaMundialContraElCáncer']
"b'En el #DiaMundialContraelCancer, recordamos que es imperioso actuar para atenuar el impacto de esta enfermedad en la regi?n. Seg?n el @IHME_UW, entre 2010 y 2017 el porcentaje de muertes por #c?ncer aument?, salvo en Uruguay, en toda Am?rica Latina. #YoSoyYVoyA #TodosPorAcceso https://t.co/KTslQMM3QE'",48466,1,IHME_UW,2020-02-04 22:01:16,0,['DiaMundialContraelCancer']
"b'Travel bans rarely prevent disease spread, but they have negative consequences?and may violate international health law. Compelling article by my @IHME_UW colleague Dr. Deepa Jahagirdar https://t.co/8VuSdbau4u @ThinkGlobalHlth'",48466,5,IHME_UW,2020-02-04 19:08:21,0,[]
"In 2017, 33.1 million incident cases of #sepsis, or two of every three cases, occurred in patients with an underlying infectious condition; the remaining 15.8 million incident cases occurred in people with underlying injuries or non-communicable diseases. https://t.co/De5ChkHvEI https://t.co/HFJmxi3NgQ",48466,3,IHME_UW,2020-02-04 18:30:05,5,['sepsis']
"b'?Lo estamos haciendo bien en M?xico? #D?aMundialContraElC?ncer En 30 a?os las muertes por c?ncer aumentaron al doble. La tasa de mortalidad aument? 40%, sin embargo, la tasa q controla el efecto d envejecimiento muestra disminuci?n -15%. 2 aspectos fundamentales+poblaci?n +viejos https://t.co/TL4VSGyyO4'",48466,33,IHME_UW,2020-02-04 17:15:49,0,['DíaMundialContraElCáncer']
"b'China\'s gov has received mixed reviews on its transparency during #coronarvirus outbreak. But among scientists there &amp; in US/EU, data sharing has ""been the best that I?ve ever seen in my life,"" @alexvespi said. https://t.co/S77eqyQVKy'",48466,52,IHME_UW,2020-02-03 23:55:37,0,['coronarvirus']
"b'The first #CHD #GBDStudy is out!  The burden is alarming, the global inequities demand action. Congrats to the authors for this important work: Craig Sable, Meghan Zimmerman, Alison Smith, Nick Kassebaum @bzheleva @JackieBoucherRD @gerard_md &amp; others https://t.co/p4HTOHAnJc https://t.co/4FDpSiiact'",48466,15,IHME_UW,2020-02-03 19:37:17,0,"['CHD', 'GBDStudy']"
"b'?Sabes c?mo afecta la contaminaci?n a nuestra salud cerebral?. En Espa?a, causa unas 27.000 muertes prematuras al a?o. https://t.co/Z0VIAe2Dlf cc/ @IHME_UW @yale @seneurologia'",48466,3,IHME_UW,2020-02-03 19:36:11,0,[]
"According to a recent study in @LancetGastroHep, #cirrhosis accounted for 2.4% of total deaths globally in 2017 compared to just 1.9% in 1990. Read the study: https://t.co/5shiB3DaYb https://t.co/vCNgSSiuo0",48466,6,IHME_UW,2020-02-03 19:00:07,7,['cirrhosis']
b'For tomorrow?s #WorldCancerDay I ask whether the world is making progress against cancer.  Deaths from cancer increased. Mostly because of population growth; the rate increased only a quarter as much. Adjusted for aging the death rate declined.  https://t.co/ru1IwiVSOI',48466,61,IHME_UW,2020-02-03 17:12:21,0,['WorldCancerDay']
"b'There is a big crowd of @CHSJaguars students in the house for a discussion of global health and data with the one and only Chris Murray of @IHME_UW.  I know that you would be very inspired by these students, @DrTedros. One day, these students will be your colleagues. https://t.co/DExtxH65Qy'",48466,4,IHME_UW,2020-01-31 23:29:19,0,[]
A new article from @AJC highlights recent changes life expectancy due to drug overdose deaths using data from the #GBDstudy and the National Center for Health Statistics. https://t.co/iv106vEK84 https://t.co/C7cuJd9DrM,48466,1,IHME_UW,2020-01-31 23:20:08,4,['GBDstudy']
b'2019-nCoV: the early lessons. https://t.co/grbWldh3t1',48466,53,IHME_UW,2020-01-31 20:51:52,0,[]
Today is the final day to submit your Roux Prize 2020 nomination to recognize someone who has used health evidence in innovative ways to make people healthier. Submit your nomination today: https://t.co/Rh5LuSawI7 https://t.co/4opQSboLXZ,48466,1,IHME_UW,2020-01-31 17:45:09,0,[]
"b'""#NTDs have blinded, disabled, disfigured and killed their victims for centuries."" On #WorldNTDDay, check out this editorial on  @VOANews about @USAID\'s commitment to #beatNTDs: https://t.co/vbsFK3rDuc @USAIDGH'",48466,5,IHME_UW,2020-01-31 00:08:03,0,"['NTDs', 'WorldNTDDay']"
"b'?As long as socioeconomic and cultural inequities persist, neglected and marginalised populations will remain at risk, trapped in cycles of poverty. #WorldNTDDay invites us to regroup to #BeatNTDs: For good. For all.? https://t.co/hD6P2PbuwJ'",48466,15,IHME_UW,2020-01-31 00:07:50,0,[]
"b'To #beatNTDS, we need better diagnostics across the board to tell us where to channel limited resources &amp; when countries have definitively reached their elimination goals ?. That?s why investing in R&amp;D is a priority for our NTD work. #WorldNTDDay https://t.co/Xzd0cqiIrN'",48466,53,IHME_UW,2020-01-31 00:06:37,0,['beatNTDS']
"b'If the world keeps up the fight against these neglected tropical diseases, we can improve the lives of millions of families: https://t.co/Naourwhu9i #WorldNTDDay https://t.co/eRiBlWI4at'",48466,524,IHME_UW,2020-01-31 00:06:22,0,[]
"Nominations for the 2020 Roux Prize close tomorrow Friday, January 31, 2020. The prize recognizes someone who has used health evidence in innovative ways to make people healthier. Submit a nomination today: https://t.co/Rh5LuRSVQz https://t.co/Rh8FfXuyi6",48466,1,IHME_UW,2020-01-30 23:33:10,0,[]
b'NTDs were one of the few health &amp; development issues that didn?t have an awareness day?until 300+ partners rallied today. #EB146: Let?s make 30 January an official milestone to renew our commitments to #BeatNTDs: For Good. For All!',48466,15,IHME_UW,2020-01-30 22:15:08,0,[]
"b'La r?pida propagaci?n del coronavirus, que ya ha causado m?s de 7.800 casos, es una emergencia internacional, declar? @WHO.  La designaci?n ayuda a movilizar fondos para contener el brote originado en China y ahora presente en otros 18 pa?ses. M?s datos: https://t.co/hLqQdFK2Pk https://t.co/nYgmL7BzDv'",48466,1224,IHME_UW,2020-01-30 22:13:44,0,[]
"b'#BREAKING: @WHO has declared #nCoV2019 a Public Health Emergency of International Concern.   For real-time updates on #coronavirus, visit: https://t.co/1VShFPzM1M  A special thanks to our partners at @UniofOxford @Tsinghua_Uni @IHME_UW @BostonChildrens @Northeastern @harvardmed https://t.co/9isPWguSi9'",48466,56,IHME_UW,2020-01-30 22:13:19,0,"['BREAKING', 'nCoV2019']"
"b'A?without NTDs is a world where more children can excel in school, more adults can earn a living &amp; more communities thrive. That?s why every $1 spent on NTDs creates $27-$42 in economic benefit. #BeatNTDs https://t.co/1We6o89K8E'",48466,36,IHME_UW,2020-01-30 22:02:33,0,[]
b'Men twice as likely as women to die of liver cirrhosis https://t.co/djftD4i5SA via @IHME_UW',48466,1,IHME_UW,2020-01-30 21:53:47,0,[]
More than 1.5 billion people are at risk of neglected tropical diseases primarily in low- and middle-income countries. Strengthening health systems that reach the most vulnerable communities is critical to reducing the burden of NTDs. #WorldNTDDay https://t.co/ifD4LIKcsQ https://t.co/C22Wm2lvMP,48466,6,IHME_UW,2020-01-30 17:40:01,9,['WorldNTDDay']
"b'Global, regional, and national sepsis incidence and mortality, 1990?2017 ""Despite declining age-standardized incidence and mortality, sepsis remains a major cause of health loss worldwide..."" https://t.co/NN8zoez3ws via @IHME_UW https://t.co/c0dHQaPeXC'",48466,2,IHME_UW,2020-01-30 17:29:42,0,[]
b'Bobby Reiner of @IHME_UW developing local burden of lower respiratory infection prevalence are found to use for planning and evaluation. #StopPneumonia #FightingforBreath https://t.co/aNXrDkeOXW',48466,3,IHME_UW,2020-01-30 17:29:27,0,[]
"b'?In estimating burden of disease, national (or even sub-national) averages may obscure finer-scale geographic trends. An example using Nigeria? - Bobby Reiner, Director, Local Burden of Disease, @IHME_UW #FightingForBreath #StopPneumonia https://t.co/XkBw2PFplo'",48466,3,IHME_UW,2020-01-30 17:29:25,0,[]
b'Our new real-time map of #nCov2019 is live:  https://t.co/ieu6sjt9D1  features the amazingly detailed line list of cases produced partners at @UniofOxford @Tsinghua_Uni @IHME_UW @BostonChildrens @Northeastern @harvardmed https://t.co/TXyeTgMDUP',48466,9,IHME_UW,2020-01-30 17:29:20,0,['nCov2019']
"According to recent #research in @TheLancet, there were an estimated 48.9 million cases of #sepsis worldwide in 2017 with substantial variation of sepsis incidence by location. Learn more about the global burden of sepsis: https://t.co/De5ChkHvEI #GBDstudy https://t.co/wwNwMwqxrb",48466,3,IHME_UW,2020-01-30 00:00:05,5,"['research', 'sepsis', 'GBDstudy']"
b'Our new real-time map of #nCov2019 is now up:  https://t.co/zpsjsD8hcB  features the amazingly detailed line list of cases produced partners at @healthmap @UniofOxford @Tsinghua_Uni @IHME_UW @BostonChildrens @Northeastern @harvardmed https://t.co/GFkbGMDusu',48466,2664,IHME_UW,2020-01-29 17:49:17,0,['nCov2019']
"There is still time to submit your nominations for the 2020 Roux Prize. Nominations close this Friday, January 31, 2020. The prize recognizes someone who has used health evidence in innovative ways to make people healthier. Submit a nomination: https://t.co/Rh5LuRSVQz https://t.co/suHDEYxoQ2",48466,1,IHME_UW,2020-01-29 17:45:09,1,[]
"b""Have a look at @IHME_UW's estimates on road-death rates for every country featured in @TheEconomist:  https://t.co/UPi6UtqWYR #RoadSafety @GlobalHealthKI https://t.co/yOUrzxoCNk""",48466,3,IHME_UW,2020-01-29 17:38:38,0,[]
b'#Coronavirus and the Cruel Cost of Closing Borders. New via Deepa Jahadgirdar at @IHME_UW #2019nCOV https://t.co/7LmjWjbFBN',48466,2,IHME_UW,2020-01-29 17:38:32,0,"['Coronavirus', '2019nCOV']"
b'our new @TheLancet study showed that twice as many men as women died from liver cirrhosis in 2017. The leading underlying causes included Hepatitis B and alcohol-related liver disease. Read more about this new study: https://t.co/CZiVzPG63s  https://t.co/e5rQwzWsQi',48466,3,IHME_UW,2020-01-29 17:28:24,0,[]
There are only three days left to submit your nomination for the Roux Prize 2020! The Roux Prize was created in 2013 to honor individuals from around the world who have used health evidence in bold and innovative ways. Submit your nomination online: https://t.co/Rh5LuRSVQz https://t.co/ChhNXzsyNh,48466,4,IHME_UW,2020-01-28 23:30:05,4,[]
"b""What are some of the biggest advances we've seen domestically and internationally in #populationhealth? Help generate the content for the feature walls in the new @UW Hans Rosling Center for Population Health: https://t.co/QpPIjrTMew""",48466,6,IHME_UW,2020-01-28 21:35:57,0,['populationhealth']
"b'What is the cost of ending the unmet need for #familyplanning by 2030?  ?Browse through the latest research providing estimations, methodologies and specific interventions led by @UNFPA?? https://t.co/n8G7pYIr6l https://t.co/KgwmdWVkHm'",48466,10,IHME_UW,2020-01-28 18:25:10,0,['familyplanning']
"b'A nivel mundial, los accidentes de tr?fico matan m?s personas cada a?o que la malaria o el VIH  Investigadores de @IHME_UW estimaron la cifra de muertos en 2017 en 1,24 m. Los lugares m?s peligrosos son los pa?ses de ingresos medios https://t.co/7uv2eogjqO https://t.co/7FDC3qvXR1'",48466,2,IHME_UW,2020-01-28 17:32:12,0,[]
"b'Globally, road accidents kill more people every year than malaria or hiv/aids. Spencer James and other researchers at the @IHME_UW put the death toll in 2017 at 1.24m. By far the most dangerous places are middle income countries. https://t.co/WIF2yTz2ta https://t.co/UrBp1EtEuI'",48466,18,IHME_UW,2020-01-28 17:31:43,0,[]
"b""Jan 31 is the deadline for #RouxPrize nominations. Nominees should use health #evidence in bold ways to make people healthier and have #health impact. Go to @IHME_UW's site to nominate someone you believe deserves recognition for extraordinary work. https://t.co/1MQpKmRHi2""",48466,1,IHME_UW,2020-01-28 17:31:10,0,"['RouxPrize', 'evidence']"
"According to a a new study published in @TheLancet, twice as many men as women died from liver cirrhosis in 2017. The leading underlying causes included Hepatitis B and alcohol-related liver disease. Read more about this new study: https://t.co/7ubjZX25hh https://t.co/287LdkrRbU",48466,1,IHME_UW,2020-01-28 17:30:07,1,[]
"b'The rate of #typhoid in #Bangladesh is among the highest in the world, with an estimated 643 cases per 100K in 2017 (@IHME_UW). Typhoid conjugate #VaccinesWork and could have substantial benefit in Bangladesh: https://t.co/ZjOCJcSiQM   #ASCODD #TakeOnTyphoid https://t.co/WS8SAuGsUU'",48466,3,IHME_UW,2020-01-28 17:28:50,0,"['typhoid', 'Bangladesh']"
"b'When countries reach a GDP per head of about $30,000, death rates usually start to come down https://t.co/oqWBljsezl'",48466,80,IHME_UW,2020-01-28 14:57:19,0,[]
"b'Friends gather for the first meeting of The Lancet?s Nigeria Series, led by Ibrahim Abubakar. https://t.co/MsVxhKUncL'",48466,20,IHME_UW,2020-01-28 05:35:43,0,[]
b'Dr Cynthia continues to rise above the challenges of providing health care to the mothers of Mae Sot. Last year she was awarded the @IHME_UW Roux Prize for her work delivering health care to migrant communities. Discover Dr Cynthia?s remarkable story here: https://t.co/M1KlpS56Op https://t.co/TGoUDPGNdt',48466,1,IHME_UW,2020-01-27 16:48:31,0,[]
"b'Globally, road accidents kill more people every year than malaria or hiv/aids. Spencer James and other researchers at the @IHME_UW put the death toll in 2017 at 1.24m. By far the most dangerous places are middle income countries. https://t.co/WIF2yTz2ta https://t.co/waIzfeXVNW'",48466,34,IHME_UW,2020-01-27 16:17:32,0,[]
"According to a recent study in @TheLancet, there were 11 million #sepsis-related deaths in 2017 or 19.7% of global deaths that year. Over 46% occurred in individuals with a non-infectious cause of death. https://t.co/De5ChkHvEI https://t.co/lIWeftc6IX",48466,4,IHME_UW,2020-01-24 23:30:05,9,['sepsis']
"b'Congratulations to all on the publication of the latest study from the Global Burden of Disease, covering the growing burden of cirrhosis and chronic liver disease: https://t.co/qad4kdEJuY @LancetGastroHep @IHME_UW'",48466,3,IHME_UW,2020-01-24 20:50:24,0,[]
b'The annual growth in international development assistance for health has fallen from 10% in 2000?2010 to 1.3% in 2010?2018.  Take an immersive look at this and other forces in global health with @ThinkGlobalHlth. https://t.co/SUHrAdPOs8',48466,6,IHME_UW,2020-01-24 20:49:44,0,[]
b'Dr Geoffrey Baird presenting the role of lab medicine in public health at ?@IHME_UW? we are looking forward to collaborate on integrating such data in our #GBD https://t.co/QiyYSK06CZ',48466,1,IHME_UW,2020-01-24 20:49:40,0,[]
"The most common underlying cause of #sepsis worldwide was diarrheal diseases which accounted for 9.2 million cases, nearly 20% of all sepsis cases in 2017. Read the full study in @TheLancet: https://t.co/De5ChkHvEI #GBDstudy https://t.co/CR2WIT5rfc",48466,2,IHME_UW,2020-01-24 18:00:35,3,"['sepsis', 'GBDstudy']"
"The Roux Prize is awarded to individuals who have used health evidence in innovative ways to improve population health. Nominations are open through January 31st, 2020. Submit your nomination online: https://t.co/Rh5LuRSVQz https://t.co/D0VzTzM9ea",48466,2,IHME_UW,2020-01-23 23:45:03,2,[]
"b'New - The global, regional, and national burden of #cirrhosis by cause in 195 countries and territories, 1990?2017: a systematic analysis for the Global Burden of Disease Study 2017 - https://t.co/TvDcMB9elQ   #GBDStudy @IHME_UW #HBV #HCV #alcohol #fattyliver #NASH #livertwitter https://t.co/7kl6CujIsP'",48466,44,IHME_UW,2020-01-23 18:11:47,0,['cirrhosis']
b'@IHME_UW Plus the linked Comment by Peter L Wang and Jennifer A Flemming - Addressing the global cirrhosis epidemic: one size will not fit all   https://t.co/nbqFUKqJ3I  #cirrhosis #livertwitter #viralhepatitis #alcohol #NASH #fattyliver https://t.co/6w9xU9top9',48466,6,IHME_UW,2020-01-23 18:11:43,0,[]
